Year,Type,Name,Assets,Liabilities
2011,fire,SYCAMORE FIREFIGHTERS PENSION FUND                ,9230948.0,8522124.0
2011,fire,TAYLORVILLE FIREFIGHTERS PENSION FUND,4538634.64,3526753.0
2011,fire,TRI-STATE FPD FIREFIGHTERS PENSION FUND           ,22394888.0,6343652.0
2011,fire,TRI-TOWNSHIP FPD FIREFIGHTERS PENSION FUND,2010726.0,3701703.4032
2011,fire,UNIVERSITY PARK FIREFIGHTERS PENSION FUND,4677904.31,2314379.0
2011,fire,URBANA FIREFIGHTERS PENSION FUND                  ,30583148.0,22848727.8066
2011,fire,VILLA PARK FIREFIGHTERS PENSION FUND              ,13769936.97,10418546.0
2011,fire,WARRENVILLE FPD FIREFIGHTERS PENSION FUND,2366322.65,991891.0
2011,fire,WAUCONDA FPD FIREFIGHTER'S PENSION FUND           ,9894530.99,4093122.0
2011,fire,WEST CHICAGO FPD FIREFIGHTERS PENSION FUND,20605948.0,5019671.974
2011,fire,WEST FRANKFORT FIREFIGHTERS PENSION FUND          ,4304321.26,4984816.0
2011,fire,WESTCHESTER FIREFIGHTERS PENSION FUND,17945831.8,13902475.0
2011,fire,WESTERN SPRINGS FIREFIGHTERS PENSION FUND,354524.0,362015.9793
2011,fire,WHEATON FIREFIGHTERS PENSION FUND,19063032.72,11674103.0
2011,fire,WHEELING FIREFIGHTERS PENSION FUND,28370332.0,36489289.5616
2011,fire,WILLIAMSON COUNTY FIREFIGHTERS PENSION FUND,462539.0,209461.0931
2011,fire,WILMETTE FIREFIGHTERS PENSION FUND,34194061.0,34478812.6206
2011,fire,WILMINGTON FPD FIREFIGHTER'S PENSION FUND,90290.88,0.0
2011,fire,WIN-BUR-SEW FPD FIREFIGHTERS PENSION FUND         ,192950.11,0.0
2011,fire,WINFIELD FPD FIREFIGHTERS PENSION FUND            ,2674712.81,0.0
2011,fire,WINNETKA FIREFIGHTERS PENSION FUND,18842409.89,22563210.0
2011,fire,WOOD DALE FPD FIREFIGHTERS PENSION FUND,10664760.0,16545781.4149
2011,fire,WOOD RIVER FIREFIGHTERS PENSION FUND,4668905.88,4694317.0
2011,fire,YORK CENTER FIRE PROTECTION DISTRICT,489933.0,0.815
2012,fire,ADDISON FIREFIGHTERS PENSION FUND,38131612.0,43933226.6081
2012,fire,ALGONQUIN LAKE IN THE HILLS FPD PENSION FUND,12771027.0,7443845.7136
2012,fire,ALSIP FIREFIGHTERS PENSION FUND,19190898.0,21008139.5682
2012,fire,ALTON FIREFIGHTERS PENSION FUND                   ,18932081.0,43589867.3162
2012,fire,ANNA FIREFIGHTERS PENSION FUND,1822008.0,1476736.5304
2012,fire,ARLINGTON HEIGHTS FIREFIGHTERS PENSION FUND,70434943.0,68003066.6313
2012,fire,ATWOOD FPD FIREFIGHTERS PENSION FUND,22003.0,102616.2144
2012,fire,AURORA FIREFIGHTERS PENSION FUND,118370539.0,126850647.523
2012,fire,BARRINGTON FIREFIGHTERS PENSION FUND,12287011.0,3801735.8016
2012,fire,BARTLETT FPD FIREFIGHTERS PENSION FUND,10311887.0,5738572.6249
2012,fire,BATAVIA FIREFIGHTERS PENSION FUND,11165367.0,6191046.6818
2012,fire,BEACH PARK FPD FIRE FIGHTERS PENSION FUND         ,401486.0,627673.3676
2012,fire,BEARDSTOWN FIREFIGHTERS PENSION FUND,742377.0,459992.5097
2012,fire,BELLEVILLE FIREFIGHTERS PENSION FUND,20952101.0,31704037.4135
2012,fire,BELLWOOD FIREFIGHTERS PENSION FUND                ,20140944.0,20016988.6576
2012,fire,BELVIDERE FIREFIGHTERS PENSION FUND,11978116.0,10498050.5934
2012,fire,BEMENT FPD FIREFIGHTERS PENSION FUND,275725.0,316004.3688
2012,fire,BENSENVILLE FIREFIGHTERS PENSION FUND,10080120.0,19747345.3888
2012,fire,BENTON FIREFIGHTERS PENSION FUND                  ,3340258.0,3287731.8157
2012,fire,BERWYN FIREFIGHTERS PENSION FUND                  ,20609589.0,54403121.2621
2012,fire,BLOOMINGDALE FPD FIREFIGHTERS PENSION FUND,23381465.0,17660183.6753
2012,fire,BLOOMINGTON FIREFIGHTERS PENSION FUND,40739597.0,53217242.4731
2012,fire,BLUE ISLAND FIREFIGHTERS PENSION FUND             ,5761100.0,13368478.3151
2012,fire,BOLINGBROOK FIREFIGHTERS PENSION FUND             ,41652628.0,44887727.5687
2012,fire,BOURBONNAIS FPD FIREFIGHTERS PENSION FUND         ,1045329.0,4771.6937
2012,fire,BRADLEY FIREFIGHTERS PENSION FUND,353549.0,27068.3681
2012,fire,BRIDGEVIEW FIREFIGHTERS PENSION FUND,20151957.0,26678638.5094
2012,fire,BRISTOL-KENDALL  FIREFIGHTER'S PENSION FUND,94666.0,0.6623
2012,fire,BROADVIEW FIREFIGHTERS PENSION FUND,19151834.0,24743611.5474
2012,fire,BROOKFIELD FIREFIGHTERS PENSION FUND,11687708.0,10141876.6275
2012,fire,BUFFALO GROVE FIREFIGHTERS PENSION FUND,40617449.0,27601241.7247
2012,fire,BURBANK FIREFIGHTERS PENSION FUND,21370710.0,9448231.8169
2012,fire,BURLINGTON COMMUNITY FPD FIREFIGHTERS' PENSION FUN,91693.0,0.2015
2012,fire,BYRON FPD FIREFIGHTERS PENSION FUND,9963623.0,6519769.9012
2012,fire,CAIRO FIREFIGHTERS PENSION FUND,639287.0,3272813.1742
2012,fire,CALUMET CITY FIREFIGHTERS PENSION FUND,28819782.0,38409821.5106
2012,fire,CANTON FIRE PENSION FUND,6554177.0,11349025.4322
2012,fire,CARBONDALE FIRE PENSION FUND,12802074.0,14997479.5374
2012,fire,CARBONDALE TOWNSHIP FIREFIGHTERS PENSION FUND,898401.0,1.3113
2012,fire,CAROL STREAM FPD FIREFIGHTERS PENSION FUND,27129221.0,18402411.7198
2012,fire,CARPENTERSVILLE FIREFIGHTERS PENSION FUND,15158409.0,11072029.7446
2012,fire,CARTERVILLE FIREFIGHTER'S PENSION FUND,199011.0,0.3255
2012,fire,CARY FPD FIREFIGHTERS PENSION FUND                ,2762293.0,618343.8214
2012,fire,CENTRAL STICKNEY FPD FIREFIGHTERS PENSION FUND,8731.68,0.0
2012,fire,CENTRALIA FIREFIGHTERS PENSION FUND               ,10280181.0,10958913.6267
2012,fire,CENTRALIA FPD FIREFIGHTERS PENSION FUND           ,472943.0,420410.7094
2012,fire,CHAMPAIGN FIREFIGHTERS PENSION FUND,60488690.0,45093811.7506
2012,fire,CHANNAHON FIRE PROTECTION DISTRICT FIREFIGHTERS PE,2566925.0,547699.408
2012,fire,CHARLESTON FIREFIGHTERS PENSION FUND              ,12816336.0,21227820.4827
2012,fire,CHATHAM FPD FIREFIGHTER'S PENSION FUND,1748285.0,0.64
2012,fire,CHERRY VALLEY FPD FIREFIGHTER'S PENSION FUND,1622800.0,0.6603
2012,fire,CHICAGO HEIGHTS FIREFIGHTERS PENSION FUND         ,34494033.0,46142759.501
2012,fire,CHICAGO RIDGE FIREFIGHTERS PENSION FUND,8627161.0,3411039.6338
2012,fire,CICERO FIREFIGHTERS' PENSION FUND,27249078.0,54945264.3138
2012,fire,CLARENDON HILLS FIREFIGHTERS PENSION FUND,921390.0,0.6606
2012,fire,CLINTON FIREFIGHTERS PENSION FUND,1491008.0,2036807.6021
2012,fire,COAL CITY FIREFIGHTER'S PENSION FUND,343887.0,0.7685
2012,fire,COLLINSVILLE FIREFIGHTERS PENSION FUND            ,18915735.18,16699424.006
2012,fire,COUNTRY CLUB HILLS  FIREFIGHTERS PENSION FUND,6279871.0,8338920.5464
2012,fire,COUNTRYSIDE FPD FIREFIGHTERS  PENSION FUND,20638811.0,19668086.6978
2012,fire,CRYSTAL LAKE FIREFIGHTERS PENSION FUND            ,19695155.0,13222481.6428
2012,fire,DANVILLE FIREFIGHTERS PENSION FUND,12963833.0,36275173.2448
2012,fire,DARIEN WOODRIDGE FPD FIREFIGHTERS PENSION FUND,15345923.0,11398404.6587
2012,fire,DECATUR FIREFIGHTERS PENSION FUND,61778838.0,75653259.5373
2012,fire,DEERFIELD-BANNOCKBURN FIRE PROTECTION DISTRICT,29105302.0,18915643.8202
2012,fire,DEKALB FIREFIGHTERS PENSION FUND,21092457.0,39384892.3665
2012,fire,DES PLAINES FIREFIGHTERS PENSION FUND,60419513.0,77733708.5107
2012,fire,DIXON COMMUNITY FPD FIREFIGHTER PENSION FUND      ,4044580.0,4856068.5555
2012,fire,DIXON FIREFIGHTERS PENSION FUND,8142612.0,10039524.5896
2012,fire,DOLTON FIREFIGHTERS PENSION FUND,11310804.0,10744393.7009
2012,fire,DOWNERS GROVE FIREFIGHTERS PENSION FUND,37673399.0,39200970.5384
2012,fire,DUQUOIN FIREFIGHTERS PENSION FUND,2398752.0,4018127.3661
2012,fire,EAST ALTON FIREFIGHTERS PENSION FUND,1926322.0,3683616.276
2012,fire,EAST DUNDEE/COUNTRYSIDE FPD FIREFIGHTERS PENSION F,1887828.0,623493.7597
2012,fire,EAST JOLIET FPD FIREFIGHTERS PENSION FUND,1482351.0,169160.3846
2012,fire,EAST MOLINE FIREFIGHTERS PENSION FUND,21008410.0,19712099.7399
2012,fire,EAST PEORIA FIREFIGHTERS PENSION FUND             ,16876350.0,18290720.5812
2012,fire,EAST ST LOUIS FIREFIGHTERS PENSION FUND,12446969.0,35496028.2421
2012,fire,EDWARDSVILLE FIREFIGHTERS PENSION FUND,11451783.0,14115583.6235
2012,fire,EFFINGHAM FIREFIGHTERS PENSION FUND               ,8153405.0,10166970.6382
2012,fire,ELBURN/COUNTRYSIDE FPD FIREFIGHTERS PENSION FUND  ,3465048.0,1166695.591
2012,fire,ELGIN FIREFIGHTERS PENSION FUND                   ,56940984.0,69090364.4568
2012,fire,ELK GROVE VILLAGE FIREFIGHTERS PENSION FUND,54322810.0,63903018.5523
2012,fire,ELMHURST FIREFIGHTERS PENSION FUND,30347270.0,23275183.6669
2012,fire,ELMWOOD PARK FIREFIGHTERS PENSION FUND            ,11510023.0,16310092.4095
2012,fire,ELWOOD FIRE PROTECTION DISTRICT,809997.0,0.8417
2012,fire,EVANSTON FIREFIGHTERS PENSION FUND                ,59947784.0,95740478.4458
2012,fire,EVERGREEN PARK FIREFIGHTERS PENSION FUND          ,991865.0,2397122.3081
2012,fire,FAIRFIELD FIREFIGHTERS PENSION FUND,1463452.0,1339169.4752
2012,fire,FAIRVIEW/CASEYVILLE FPD FIREFIGHTERS  PENSION FUND,1972530.0,1366297.7091
2012,fire,FLOSSMOOR FIREFIGHTERS PENSION FUND,2092811.0,4223619.3994
2012,fire,FOREST PARK FIREFIGHTERS PENSION FUND,14278981.0,20130254.5024
2012,fire,FOREST VIEW FIREFIGHTERS PENSION FUND,2154153.0,3741528.3812
2012,fire,FOSTERBURG FPD FIREFIGHTERS PENSION FUND,987834.0,465961.5761
2012,fire,FOX LAKE FIREFIGHTERS PENSION FUND                ,209287.24,0.0
2012,fire,FOX LAKE FPD  FIREFIGHTER'S PENSION FUND,193112.0,0.5704
2012,fire,FOX RIVER GROVE FPD FIREFIGHTERS PENSION FUND,5630.01,0.0
2012,fire,FRANKFORT FPD FIREFIGHTERS PENSION FUND           ,7359376.0,199152.9115
2012,fire,FRANKLIN PARK FIREFIGHTERS PENSION FUND,21773474.0,27242662.485
2012,fire,FREEPORT FIREFIGHTERS PENSION FUND,29732706.0,24995401.7437
2012,fire,GALESBURG FIRE FIGHTERS PENSION FUND,21243745.0,32116620.4814
2012,fire,GENEVA FIREFIGHTERS PENSION FUND,11131837.0,1956091.8997
2012,fire,GLENCOE FIREFIGHTERS PENSION FUND,39554.0,825165.0479
2012,fire,GLENSIDE FPD FIREFIGHTERS PENSION FUND            ,7362938.0,9692940.5287
2012,fire,GLENVIEW FIREFIGHTERS PENSION FUND,55618160.0,65679369.5614
2012,fire,GLENWOOD FIREFIGHTERS PENSION FUND,2403749.0,2465364.5838
2012,fire,GODFREY PAID FIREFIGHTERS PENSION FUND            ,5669092.0,4282474.7197
2012,fire,GRANITE CITY FIREFIGHTERS PENSION FUND C/O GAIL VA,17393812.0,32430267.3462
2012,fire,GRAYSLAKE FPD FIREFIGHTERS PENSION FUND,10362853.0,6176450.6122
2012,fire,GREATER ROUND LAKE FPD FIREFIGHTERS PENSION FUND  ,11349481.0,5558293.7214
2012,fire,GURNEE FIREFIGHTERS PENSION FUND                  ,21178347.0,9433976.7382
2012,fire,HAMPSHIRE FPD FIREFIGHTERS PENSION FUND,1298435.0,14298.7016
2012,fire,HANOVER PARK FIREFIGHTERS PENSION FUND            ,12437454.0,11548712.6138
2012,fire,HARLEM-ROSCOE FIREFIGHTERS PENSION FUND,66807.0,1.1991
2012,fire,HARRISBURG FIREFIGHTERS PENSION FUND              ,2822136.0,1175389.6226
2012,fire,HARVARD FPD PENSION FUND,88015.01,0.0
2012,fire,HARVEY FIREFIGHTERS PENSION FUND,13870200.0,23088529.3548
2012,fire,HAZEL CREST FIREFIGHTERS PENSION FUND,6287535.0,5097580.758
2012,fire,HERRIN FIREFIGHTERS PENSION FUND,5326603.0,5522792.467
2012,fire,HIGHLAND PARK FIREFIGHTERS PENSION FUND,30879697.0,39656267.4849
2012,fire,HIGHWOOD FIREFIGHTERS PENSION FUND,2471786.0,488203.6793
2012,fire,HILLSBORO FIREFIGHTER'S PENSION FUND,630057.0,650291.4937
2012,fire,HILLSIDE FIREFIGHTERS PENSION FUND,9623870.0,10782271.479
2012,fire,HINCKLEY COMMUNITY FPD FIREFIGHTER'S PENSION FUND,2840.51,0.0
2012,fire,HINSDALE FIREFIGHTERS PENSION FUND,14737779.0,15713951.6054
2012,fire,HOFFMAN ESTATES FIREFIGHTERS PENSION FUND,60867862.0,46915049.664
2012,fire,HOMER TOWNSHIP FPD FIREFIGHTERS PENSION FUND,6095072.0,479463.9132
2012,fire,HOMEWOOD FIREFIGHTERS PENSION FUND                ,10007487.0,9682054.6474
2012,fire,HUNTLEY FPD FIREFIGHTERS PENSION FUND,14020357.0,3429370.9614
2012,fire,ITASCA FPD #1 FIREFIGHTERS PENSION FUND,8010650.0,4745383.5565
2012,fire,IVESDALE FPD FIREFIGHTERS PENSION FUND,89601.0,0.4043
2012,fire,JACKSONVILLE FIREFIGHTERS PENSION FUND,15873125.0,15161398.7
2012,fire,JEFFERSON FPD FIREFIGHTERS PENSION FUND,1313032.0,779962.6149
2012,fire,JERSEYVILLE FIREFIGHTER'S PENSION FUND            ,123520.0,0.6583
2012,fire,JOLIET FIREFIGHTERS PENSION FUND,90521910.0,106189108.4504
2012,fire,JUSTICE FIREFIGHTERS PENSION FUND,209483.0,909615.2303
2012,fire,KANKAKEE FIREFIGHTERS' PENSION FUND,9294304.0,33478978.1865
2012,fire,KEWANEE COMMUNITY FPD FIREFIGHTERS PENSION FUND,390529.0,508175.3992
2012,fire,KEWANEE FIREFIGHTERS PENSION FUND,8170675.0,6993320.6308
2012,fire,LAGRANGE FIREFIGHTERS PENSION FUND                ,9272945.0,16685204.4087
2012,fire,LAKE EGYPT FPD FIREFIGHTERS PENSION FUND,900678.0,0.8652
2012,fire,LAKE FOREST FIREFIGHTERS PENSION FUND,27141822.0,21780233.7291
2012,fire,LAKE VILLA FPD FIREFIGHTER'S PENSION FUND,299049.55,0.0
2012,fire,LAKE ZURICH FIREFIGHTERS PENSION FUND,16190410.0,6828807.5088
2012,fire,LANSING FIREFIGHTERS PENSION FUND,11251159.0,13119555.5509
2012,fire,LASALLE FIREFIGHTERS PENSION FUND                 ,1513440.0,836615.5732
2012,fire,LEMONT FPD FIREFIGHTERS PENSION FUND,16157117.0,5164014.6602
2012,fire,LEYDEN FPD FIREFIGHTERS PENSION FUND,6101504.0,9830160.4468
2012,fire,LIBERTYVILLE FIREFIGHTERS PENSION FUND,19444708.0,16453756.6354
2012,fire,LINCOLN FIREFIGHTERS PENSION FUND,6431357.0,13676419.3659
2012,fire,LINCOLN RURAL FPD FIREFIGHTERS PENSION FUND,3501577.0,2956481.0104
2012,fire,LINCOLNSHIRE-RIVERWOOD FPD FIREFIGHTERS PENSION FU,23605363.0,15920486.8126
2012,fire,LISLE-WOODRIDGE FPD FIREFIGHTERS PENSION FUND,46815357.0,44675302.4938
2012,fire,LITCHFIELD FIREFIGHTERS PENSION FUND,4413572.0,5779671.6421
2012,fire,LOCKPORT TOWNSHIP FPD FIREFIGHTERS PENSION FUND,30247166.0,20267284.6428
2012,fire,LOMBARD FIREFIGHTERS PENSION FUND,44724171.0,37630651.7358
2012,fire,LONG CREEK FPD FIREFIGHTERS PENSION FUND,681698.0,561277.9766
2012,fire,LONG GROVE FIREFIGHTERS PENSION FUND,5941369.0,945542.9818
2012,fire,LYONS FIREFIGHTERS PENSION FUND                   ,4711.0,424970.0111
2012,fire,MACOMB FIREFIGHTERS PENSION FUND                  ,10071696.0,11414231.5936
2012,fire,MANHATTAN FPD FIREFIGHTER'S PENSION FUND,397728.0,0.6557
2012,fire,MANTENO COMMUNITY FPD FIREFIGHTERS PENSION FUND,3194806.0,1509828.7111
2012,fire,MARION FIREFIGHTERS PENSION FUND,8014317.0,6178470.6777
2012,fire,MARKHAM FIREFIGHTERS PENSION FUND                 ,4444563.21,1227549.0006
2012,fire,MARYVILLE FIREFIGHTER'S PENSION FUND,430069.0,0.4876
2012,fire,MATTESON FIREFIGHTERS PENSION FUND,17918453.0,19011678.6385
2012,fire,MATTOON FIREFIGHTERS PENSION FUND,15133396.0,26999988.4197
2012,fire,MAYWOOD FIREFIGHTERS PENSION FUND,13719034.0,27060578.3514
2012,fire,MCCOOK FIREFIGHTERS PENSION FUND,412625.0,0.4397
2012,fire,MCHENRY TOWNSHIP FIREFIGHTERS PENSION FUND,10667.0,0.6605
2012,fire,MELROSE PARK FIREFIGHTERS PENSION FUND,19863202.0,52069818.2751
2012,fire,MENDOTA FIREFIGHTERS PENSION FUND,2031370.0,802227.5571
2012,fire,METROPOLIS FIREFIGHTERS PENSION FUND,3247927.0,2018844.5965
2012,fire,MIDLOTHIAN FIREFIGHTERS PENSION FUND,7834915.0,9519671.5818
2012,fire,MINOOKA FPD FIREFIGHTERS PENSION FUND             ,2358674.0,669787.6917
2012,fire,MOKENA FPD FIREFIGHTERS PENSION FUND              ,6231948.0,563262.7719
2012,fire,MOLINE FIREFIGHTERS PENSION FUND,27365097.0,53824531.351
2012,fire,MONMOUTH FIREFIGHTERS PENSION FUND                ,4415297.0,8443983.3921
2012,fire,MONTGOMERY & COUNTRYSIDE FPD FIREFIGHTER'S PENSION,174991.0,0.6214
2012,fire,MORTON GROVE FIREFIGHTERS PENSION FUND,26312845.0,30706959.5122
2012,fire,MT CARMEL FIREFIGHTERS PENSION FUND,1408365.0,1300462.5749
2012,fire,MT PROSPECT FIREFIGHTERS PENSION FUND             ,47608576.0,51007803.5645
2012,fire,MT VERNON FIREFIGHTERS PENSION FUND,12377910.0,15855615.5585
2012,fire,MT ZION FPD FIREFIGHTERS PENSION FUND,889549.0,29387.0941
2012,fire,MUNDELEIN FIREFIGHTERS PENSION FUND,15222386.0,9758225.8071
2012,fire,MURPHYSBORO FIREFIGHTERS PENSION FUND,3645090.0,4466159.5053
2012,fire,NAPERVILLE FIREFIGHTERS PENSION FUND,105549684.0,62724461.7346
2012,fire,NEW LENOX FPD FIREFIGHTERS PENSION FUND,2042273.0,1431153.8853
2012,fire,NEWPORT TOWNSHIP FPD FIREFIGHTERS PENSION FUND,744606.0,0.5739
2012,fire,NILES FIREFIGHTERS PENSION FUND,26473512.0,40870774.4222
2012,fire,NORMAL FIREFIGHTERS PENSION FUND,24359181.0,26693744.5733
2012,fire,NORTH AURORA FPD FIREFIGHTERS PENSION FUND,3621405.0,361201.6582
2012,fire,NORTH CHICAGO FIREFIGHTERS PENSION FUND,8998128.0,15021646.3893
2012,fire,NORTH MAINE FPD FIREFIGHTERS PENSION FUND,15256296.0,16678923.5739
2012,fire,NORTH PALOS FPD FIREFIGHTERS PENSION FUND,9815457.0,4371277.6844
2012,fire,NORTH PARK FPD FIREFIGHTER'S PENSION FUND         ,101607.0,21539.7182
2012,fire,NORTH RIVERSIDE FIREFIGHTERS PENSION FUND,8851909.0,11971578.4304
2012,fire,NORTHBROOK FIREFIGHTERS PENSION FUND              ,41693528.0,36292298.6265
2012,fire,NORTHLAKE FPD FIREFIGHTERS PENSION FUND,10706680.0,9201317.6979
2012,fire,NORTHWEST HOMER FPD FIREFIGHTERS PENSION FUND,2780978.0,1635109.7322
2012,fire,NORTHWEST ST CLAIR COUNTY FPD FIREFIGHTERS PENSION,501355.0,0.7322
2012,fire,NORWOOD PARK FPD FIREFIGHTERS PENSION FUND,12091658.0,12388030.5208
2012,fire,NUNDA RURAL FPD FIREFIGHTERS PENSION FUND         ,10010.0,285077.0351
2012,fire,OAK BROOK FIREFIGHTERS PENSION FUND,23656419.0,26653066.5901
2012,fire,OAK FOREST FIREFIGHTERS PENSION FUND,15276235.0,11340861.7115
2012,fire,OAK LAWN FIREFIGHTERS PENSION FUND,71636877.0,74144695.6309
2012,fire,OAK PARK FIREFIGHTERS PENSION FUND,40020212.0,64983336.4264
2012,fire,OAKBROOK TERRACE FIRE PROTECTION DISTRICT         ,1436817.0,0.5331
2012,fire,OLNEY FIREFIGHTERS PENSION FUND,2030530.0,2591329.5612
2012,fire,ORLAND FPD FIREFIGHTERS PENSION FUND,104657369.0,34012071.0439
2012,fire,OSWEGO FPD FIREFIGHTERS PENSION FUND,5312263.0,16820.9826
2012,fire,OTTAWA FIREFIGHTERS PENSION FUND                  ,12665960.0,17257224.5286
2012,fire,PALATINE FIREFIGHTERS PENSION FUND,51028779.0,56878731.5571
2012,fire,PALATINE RURAL FPD FIREFIGHTERS PENSION FUND,7581678.0,1453273.8142
2012,fire,PALOS FIRE PROTECTION DISTRICT PENSION FUND       ,9726022.0,2684972.7217
2012,fire,PALOS HEIGHTS FPD PENSION FUND,7270634.0,5299431.6527
2012,fire,PARIS FIREFIGHTERS PENSION FUND                   ,5013842.0,7507810.4844
2012,fire,PARK FOREST FIREFIGHTERS PENSION FUND,10494458.0,10455645.5212
2012,fire,PARK RIDGE FIREFIGHTERS PENSION FUND,35669502.0,36111649.6597
2012,fire,PEKIN FIREFIGHTERS PENSION FUND,19025154.0,33061917.3832
2012,fire,PEORIA FIREFIGHTERS PENSION FUND,122327381.0,130336726.583
2012,fire,PEOTONE FPD FIREFIGHTERS PENSION FUND,1015999.0,50451.9937
2012,fire,PERU FIREFIGHTERS PENSION FUND,1883062.0,1016612.6186
2012,fire,PINGREE GROVE & COUNTRYSIDE FPD FIREFIGHTER'S PENS,543180.0,0.3771
2012,fire,PLAINFIELD FPD FIREFIGHTERS PENSION FUND,9000324.0,1.5037
2012,fire,PLEASANTVIEW FPD,25169941.0,23575782.6176
2012,fire,PONTIAC FIREFIGHTERS PENSION FUND,3834139.0,4467772.5564
2012,fire,POSEN FIREFIGHTERS PENSION FUND,409798.0,1500586.2731
2012,fire,PRINCETON FIREFIGHTERS PENSION FUND,5651802.0,5863687.6699
2012,fire,PROSPECT HEIGHTS FPD FIREFIGHTERS PENSION FUND,2367479.0,61679.6186
2012,fire,QUINCY FIREFIGHTERS PENSION FUND                  ,23823560.0,39950896.4241
2012,fire,RIVER FOREST FIREFIGHTERS PENSION FUND,14258475.0,14871297.5653
2012,fire,RIVERDALE FIREFIGHTERS PENSION FUND,4261442.0,4237062.5537
2012,fire,ROBBINS FIREFIGHTERS PENSION FUND                 ,405703.0,0.8075
2012,fire,ROBERTS PARK FPD FIREFIGHTERS PENSION FUND        ,9973268.0,10857969.6417
2012,fire,ROBINSON FPD FIREFIGHTERS PENSION FUND,3383779.0,2891434.6759
2012,fire,ROCHELLE FIREFIGHTERS PENSION FUND,7414206.0,7814190.6952
2012,fire,ROCK FALLS FIREFIGHTERS PENSION FUND,6358881.0,3979932.8033
2012,fire,ROCK ISLAND FIREFIGHTERS PENSION FUND,23610007.0,45524850.3808
2012,fire,ROCKFORD FIREFIGHTERS PENSION FUND                ,147466114.0,186122730.5334
2012,fire,ROLLING MEADOWS FIREFIGHTERS PENSION FUND,23040203.0,42263642.3996
2012,fire,ROMEOVILLE FIREFIGHTERS PENSION FUND,4980819.0,72626.8679
2012,fire,ROSELLE FIREFIGHTERS PENSION FUND,4749146.0,856945.671
2012,fire,RUTLAND/DUNDEE TWPS FPD FIREFIGHTER'S PENSION FUND,2179176.0,436271.6865
2012,fire,SALEM FPD FIREFIGHTERS PENSION FUND,1750264.0,1653477.6839
2012,fire,SAUK VILLAGE FIREFIGHTERS PENSION FUND,159275.0,233408.4095
2012,fire,SAVANNA FIREFIGHTERS PENSION FUND                 ,1303581.0,1775842.4989
2012,fire,SCHAUMBURG FIREFIGHTERS PENSION FUND,90323660.0,79180442.6468
2012,fire,SCHILLER PARK FIREFIGHTERS PENSION FUND,10756363.0,14284356.5169
2012,fire,SHELBYVILLE FPD FIREFIGHTERS PENSION FUND,902826.0,1742742.4261
2012,fire,SIGNAL HILL FPD FIREFIGHTERS PENSION FUND,483706.0,0.7739
2012,fire,SILVIS FIREFIGHTERS PENSION FUND                  ,300020.0,0.6975
2012,fire,SKOKIE FIREFIGHTERS PENSION FUND,65566547.0,71053508.536
2012,fire,SOUTH BELOIT FIREFIGHTERS PENSION FUND            ,801784.0,543805.3406
2012,fire,SOUTH CHICAGO HEIGHTS FIREFIGHTERS PENSION FUND,78794.0,360871.2183
2012,fire,SOUTH ELGIN/COUNTRYSIDE FPD FIREFIGHTERS PENSION F,6651714.0,1705663.5674
2012,fire,SOUTH HOLLAND FIREFIGHTERS PENSION FUND,9974181.0,8170040.7117
2012,fire,SPRINGFIELD FIREFIGHTER'S PENSION FUND,98884664.0,161871209.4299
2012,fire,ST CHARLES FIREFIGHTERS PENSION FUND,28188619.0,12525802.849
2012,fire,STERLING FIREFIGHTERS PENSION FUND,11411884.0,11643292.6029
2012,fire,STILLMAN FPD PENSION FUND                         ,135805.0,0.9521
2012,fire,STREAMWOOD FIREFIGHTERS PENSION FUND,27723170.0,18211503.76
2012,fire,STREATOR FIREFIGHTERS PENSION FUND                ,4666382.0,7348401.4103
2012,fire,SUGAR GROVE FPD FIREFIGHTER'S PENSION FUND,1356316.0,75.6165
2012,fire,SULLIVAN FPD FIREFIGHTERS PENSION FUND,2987019.0,3043977.5909
2012,fire,SWANSEA FIREFIGHTERS PENSION FUND                 ,352856.0,0.4858
2012,fire,SYCAMORE FIREFIGHTERS PENSION FUND                ,10225046.0,11163567.5439
2012,fire,TAYLORVILLE FIREFIGHTERS PENSION FUND,4778027.0,4539428.6267
2012,fire,TRI-STATE FPD FIREFIGHTERS PENSION FUND           ,25019873.0,8586166.8151
2012,fire,TRI-TOWNSHIP FPD FIREFIGHTERS PENSION FUND,2039398.0,3623804.3966
2012,fire,TROY FPD FIREFIGHTER'S PENSION FUND,243473.0,0.5645
2012,fire,UNIVERSITY PARK FIREFIGHTERS PENSION FUND,4970108.0,2747723.7084
2012,fire,URBANA FIREFIGHTERS PENSION FUND                  ,32958365.0,23817973.822
2012,fire,VILLA PARK FIREFIGHTERS PENSION FUND              ,14597197.0,12242087.7306
2012,fire,WARRENVILLE FPD FIREFIGHTERS PENSION FUND,2802709.0,1178050.7592
2012,fire,WAUCONDA FPD FIREFIGHTER'S PENSION FUND           ,12134633.0,4553540.4767
2012,fire,WAUKEGAN FIREFIGHTERS PENSION FUND,49096063.0,61526965.4745
2012,fire,WEST CHICAGO FPD FIREFIGHTERS PENSION FUND,22828544.0,7307126.9555
2012,fire,WEST DUNDEE FIREFIGHTERS PENSION FUND,5340252.0,4128075.6986
2012,fire,WEST FRANKFORT FIREFIGHTERS PENSION FUND          ,4395645.0,5548867.5759
2012,fire,WESTCHESTER FIREFIGHTERS PENSION FUND,19081255.0,15967326.7251
2012,fire,WESTERN SPRINGS FIREFIGHTERS PENSION FUND,347420.0,299954.1582
2012,fire,WHEATON FIREFIGHTERS PENSION FUND,20972221.0,14253324.6829
2012,fire,WHEELING FIREFIGHTERS PENSION FUND,29206448.0,38522499.5373
2012,fire,WILLIAMSON COUNTY FIREFIGHTERS PENSION FUND,564739.0,235735.0851
2012,fire,WILLOW SPRINGS FIREFIGHTERS PENSION FUND          ,160332.0,730364.1632
2012,fire,WILMETTE FIREFIGHTERS PENSION FUND,36323031.0,34713891.6256
2012,fire,WILMINGTON FPD FIREFIGHTER'S PENSION FUND,148244.0,0.3594
2012,fire,WIN-BUR-SEW FPD FIREFIGHTERS PENSION FUND         ,225876.0,0.4844
2012,fire,WINFIELD FPD FIREFIGHTERS PENSION FUND            ,3117605.0,54187.9104
2012,fire,WINNETKA FIREFIGHTERS PENSION FUND,19516927.0,24644286.6041
2012,fire,WOOD DALE FPD FIREFIGHTERS PENSION FUND,11343889.0,18320015.4057
2012,fire,WOOD RIVER FIREFIGHTERS PENSION FUND,4791355.05,5898630.134099999
2012,fire,WOODSTOCK FIRE/RESCUE DISTRICT FIREFIGHTERS PENSIO,3414624.0,649949.5336
2012,fire,WORTH FIREFIGHTERS PENSION FUND,2824976.0,2800353.0088
2012,fire,YORK CENTER FIRE PROTECTION DISTRICT,551248.0,0.8059
2012,fire,ZION FIREFIGHTERS PENSION FUND                    ,14595976.0,16242408.5812
2013,fire,ADDISON FIREFIGHTERS PENSION FUND,39856779.0,45448353.6128
2013,fire,ALGONQUIN LAKE IN THE HILLS FPD PENSION FUND,14448835.0,7422676.7606
2013,fire,ALSIP FIREFIGHTERS PENSION FUND,20270951.0,22544545.5685
2013,fire,ALTON FIREFIGHTERS PENSION FUND                   ,18962373.0,46123472.3048
2013,fire,ANNA FIREFIGHTERS PENSION FUND,1851077.0,3065530.4718
2013,fire,ARLINGTON HEIGHTS FIREFIGHTERS PENSION FUND,75475150.0,69481199.6445
2013,fire,ATWOOD FPD FIREFIGHTERS PENSION FUND,8411.92,98094.6758
2013,fire,AURORA FIREFIGHTERS PENSION FUND,127276751.41,129405233.81230001
2013,fire,BARRINGTON FIREFIGHTERS PENSION FUND,13793231.08,4894730.1686
2013,fire,BARTLETT FPD FIREFIGHTERS PENSION FUND,11886186.05,5493853.4788999995
2013,fire,BATAVIA FIREFIGHTERS PENSION FUND,12326287.09,7358929.6401
2013,fire,BEACH PARK FPD FIRE FIGHTERS PENSION FUND         ,591610.0,611922.4764
2013,fire,BEARDSTOWN FIREFIGHTERS PENSION FUND,792626.0,317350.5695
2013,fire,BELLEVILLE FIREFIGHTERS PENSION FUND,22165671.0,33060697.428
2013,fire,BELLWOOD FIREFIGHTERS PENSION FUND                ,20919824.45,20572734.0028
2013,fire,BELVIDERE FIREFIGHTERS PENSION FUND,12730668.0,10376990.611
2013,fire,BEMENT FPD FIREFIGHTERS PENSION FUND,274909.0,798774.3442
2013,fire,BENSENVILLE FIREFIGHTERS PENSION FUND,10278621.34,19815000.1673
2013,fire,BENTON FIREFIGHTERS PENSION FUND                  ,3448637.0,3327885.8126
2013,fire,BERWYN FIREFIGHTERS PENSION FUND                  ,36760159.66,51408554.549200006
2013,fire,BLOOMINGDALE FPD FIREFIGHTERS PENSION FUND,24858135.0,21654978.6688
2013,fire,BLOOMINGTON FIREFIGHTERS PENSION FUND,43170208.0,55019037.4813
2013,fire,BLUE ISLAND FIREFIGHTERS PENSION FUND             ,5837978.0,13838246.3127
2013,fire,BOLINGBROOK FIREFIGHTERS PENSION FUND             ,43219236.0,46690968.5599
