Year,Type,Fund_Name,Assets,Liabilities
2011,fire,BROOKFIELD FIREFIGHTERS PENSION FUND,11066875,17286786
2011,fire,BUFFALO GROVE FIREFIGHTERS PENSION FUND,37092312,50177843
2011,fire,BURBANK FIREFIGHTERS PENSION FUND,20020960,24770079
2011,fire,BURLINGTON COMMUNITY FPD FIREFIGHTERS' PENSION FUN,68178,393836
2011,fire,BYRON FPD FIREFIGHTERS PENSION FUND,9479123,9635939
2011,fire,CAIRO FIREFIGHTERS PENSION FUND,660361.28,2890194.06
2011,fire,CANTON FIREFIGHTERS PENSION FUND,6210729.75,13621134.06
2011,fire,CARBONDALE FIREFIGHTERS PENSION FUND,12062698.29,22512624.04
2011,fire,CAROL STREAM FPD FIREFIGHTERS PENSION FUND,24849234,33995643
2011,fire,CARPENTERSVILLE FIREFIGHTERS PENSION FUND,13453277.95,19418510.98
2011,fire,CARY FPD FIREFIGHTERS PENSION FUND,2092543.76,2502245.07
2011,fire,CENTRAL STICKNEY FPD FIREFIGHTERS PENSION FUND,0,93449
2011,fire,CENTRALIA FIREFIGHTERS PENSION FUND,9921253,16324659
2011,fire,CHAMPAIGN FIREFIGHTERS PENSION FUND,55790914,80093622
2011,fire,CHANNAHON FIRE PROTECTION DISTRICT FIREFIGHTERS PE,2041574,1846670
2011,fire,CHATHAM FPD FIREFIGHTER'S PENSION FUND,1527784,2353798
2011,fire,CHERRY VALLEY FPD FIREFIGHTER'S PENSION FUND,1233066.94,903259.58
2011,fire,CHICAGO RIDGE FIREFIGHTERS PENSION FUND,7760534,12782703
2011,fire,CICERO FIREFIGHTERS PENSION FUND,26033450,83636867
2011,fire,CLARENDON HILLS FIREFIGHTERS PENSION FUND,1049202,996608.02
2011,fire,CLINTON FIREFIGHTERS PENSION FUND,1338591.54,1829380.07
2011,fire,COLLINSVILLE FIREFIGHTERS PENSION FUND,18258541,24183520
2011,fire,COUNTRYSIDE FPD FIREFIGHTERS  PENSION FUND,19528261,27403477
2011,fire,CRYSTAL LAKE FIREFIGHTERS PENSION FUND,16972788.99,26488823.68
2011,fire,DANVILLE FIREFIGHTERS PENSION FUND,12519301.09,47380103.25
2011,fire,DARIEN WOODRIDGE FPD FIREFIGHTERS PENSION FUND,14232253,21568340
2011,fire,DECATUR FIREFIGHTERS PENSION FUND,58497760.55,106851196
2011,fire,DEKALB FIREFIGHTERS PENSION FUND,19801744,54043120
2011,fire,DES PLAINES FIREFIGHTERS PENSION FUND,57753272,113958038
2011,fire,DIXON COMMUNITY FPD FIREFIGHTER PENSION FUND,3945597.96,6075670.19
2011,fire,DIXON FIREFIGHTERS PENSION FUND,7985105.86,12775076.66
2011,fire,DOWNERS GROVE FIREFIGHTERS PENSION FUND,34934792,62942044
2011,fire,DUQUOIN FIREFIGHTERS PENSION FUND,2329734,6078895
2011,fire,EAST ALTON FIREFIGHTERS PENSION FUND,1853534.03,4833496.06
2011,fire,EAST DUNDEE/COUNTRYSIDE FPD FIREFIGHTERS PENSION F,1621095,2265411
2011,fire,EAST JOLIET FPD FIREFIGHTERS PENSION FUND,1303793,1016158
2011,fire,EAST MOLINE FIREFIGHTERS PENSION FUND,19589782.55,26902501.84
2011,fire,EAST PEORIA FIREFIGHTERS PENSION FUND,15302954.05,26695931.86
2011,fire,EAST ST LOUIS FIREFIGHTERS PENSION FUND,12173853,49990826
2011,fire,EDWARDSVILLE FIREFIGHTERS PENSION FUND,10964663.51,14147133.46
2011,fire,EFFINGHAM FIREFIGHTERS PENSION FUND,7800988.86,11099538.89
2011,fire,ELBURN/COUNTRYSIDE FPD FIREFIGHTERS PENSION FUND,2771440,4047254.77
2011,fire,ELGIN FIREFIGHTERS PENSION FUND,54044028,120422677
2011,fire,ELK GROVE VILLAGE FIREFIGHTERS PENSION FUND,51957745,89574619.2
2011,fire,ELWOOD FIRE PROTECTION DISTRICT,705856,866688
2011,fire,EVANSTON FIREFIGHTERS PENSION FUND,56591398,131298389
2011,fire,EVERGREEN PARK FIREFIGHTERS PENSION FUND,1088513,3159661
2011,fire,FAIRFIELD FIREFIGHTERS PENSION FUND,1418133.14,2174511.12
2011,fire,FAIRVIEW/CASEYVILLE FPD FIREFIGHTERS  PENSION FUND,1835914,2667662
2011,fire,FLOSSMOOR FIREFIGHTERS PENSION FUND,2064301.51,3717227.22
2011,fire,FOREST PARK FIREFIGHTERS PENSION FUND,14177990.27,26671177.67
2011,fire,FOSTERBURG FPD FIREFIGHTERS PENSION FUND,914419,1727905
2011,fire,FOX LAKE FIREFIGHTERS PENSION FUND,201636.32,0
2011,fire,FOX LAKE FIREFIGHTERS PENSION FUND,102109,190630
2011,fire,FRANKFORT FPD FIREFIGHTERS PENSION FUND,6115712,5994088
2011,fire,FRANKLIN PARK FIREFIGHTERS PENSION FUND,20546278.22,41322293.48
2011,fire,FREEPORT FIREFIGHTERS PENSION FUND,27853959.34,35810671.4
2011,fire,GALESBURG FIRE FIGHTERS PENSION FUND,21203705,42644344
2011,fire,GENEVA FIREFIGHTERS PENSION FUND,9441568.28,11791127.6
2011,fire,GLENCOE FIREFIGHTERS PENSION FUND,65478.93,887278
2011,fire,GLENSIDE FPD FIREFIGHTERS PENSION FUND,6986840.39,11736819.46
2011,fire,GLENVIEW FIREFIGHTERS PENSION FUND,53239778,93187138
2011,fire,GLENWOOD FIREFIGHTERS PENSION FUND,2132231.91,2507959.1
2011,fire,GODFREY PAID FIREFIGHTERS PENSION FUND,5110163.71,6381971.33
2011,fire,GRANITE CITY FIREFIGHTERS PENSION FUND C/O GAIL VA,17119018.12,46191104.11
2011,fire,GRAYSLAKE FPD FIREFIGHTERS PENSION FUND,9139909.06,14464894.63
2011,fire,GREATER ROUND LAKE FPD FIREFIGHTERS PENSION FUND,10049298.42,14796318.16
2011,fire,HAMPSHIRE FPD FIREFIGHTERS PENSION FUND,1072023,1505202
2011,fire,HARLEM-ROSCOE FIREFIGHTERS PENSION FUND,18073.08,-2036.61
2011,fire,HARRISBURG FIREFIGHTERS PENSION FUND,2621778,3889730.98
2011,fire,HARVARD FPD PENSION FUND,84617.7,0
2011,fire,HERRIN FIREFIGHTERS PENSION FUND,4885396.78,9595464.53
2011,fire,HIGHLAND PARK FIREFIGHTERS PENSION FUND,30038237,61082005
2011,fire,HIGHWOOD FIREFIGHTERS PENSION FUND,2205453,2521066.44
2011,fire,HILLSBORO FIREFIGHTER'S PENSION FUND,561189.35,776457.44
2011,fire,HINCKLEY COMMUNITY FPD FIREFIGHTER'S PENSION FUND,0,0
2011,fire,HINSDALE FIREFIGHTERS PENSION FUND,13903792.61,22292776.19
2011,fire,HOFFMAN ESTATES FIREFIGHTERS PENSION FUND,57881407,86270014
2011,fire,HOMER TOWNSHIP FPD FIREFIGHTERS PENSION FUND,5087962,6384890
2011,fire,HUNTLEY FPD FIREFIGHTERS PENSION FUND,11846017.86,12258608.45
2011,fire,ITASCA FPD #1 FIREFIGHTERS PENSION FUND,7123089,13418698
2011,fire,IVESDALE FPD FIREFIGHTERS PENSION FUND,68406,178802
2011,fire,JACKSONVILLE FIREFIGHTERS PENSION FUND,15371223,22712106
2011,fire,JEFFERSON FPD FIREFIGHTERS PENSION FUND,1267038,1989562
2011,fire,JOLIET FIREFIGHTERS PENSION FUND,81532439,191358933
2011,fire,JUSTICE FIREFIGHTERS PENSION FUND,211652.31,891286.07
2011,fire,LAGRANGE FIREFIGHTERS PENSION FUND,9020014.27,20512081.37
2011,fire,LAKE EGYPT FPD FIREFIGHTERS PENSION FUND,806757,916119
2011,fire,LAKE FOREST FIREFIGHTERS PENSION FUND,24865724.38,34810295.71
2011,fire,LAKE VILLA FPD FIREFIGHTER'S PENSION FUND,278351.22,0
2011,fire,LANSING FIREFIGHTERS PENSION FUND,10388756.23,18716772.25
2011,fire,LEMONT FPD FIREFIGHTERS PENSION FUND,14313530,21435093
2011,fire,LEYDEN FPD FIREFIGHTERS PENSION FUND,6135336,13102272
2011,fire,LIBERTYVILLE FIREFIGHTERS PENSION FUND,17911527.88,28376573.38
2011,fire,LINCOLN RURAL FPD FIREFIGHTERS PENSION FUND,3469691,3248717
2011,fire,LINCOLNSHIRE-RIVERWOOD FPD FIREFIGHTERS PENSION FU,21714442,26521358
2011,fire,LISLE-WOODRIDGE FPD FIREFIGHTERS PENSION FUND,43878910,87066413
2011,fire,LITCHFIELD FIREFIGHTERS PENSION FUND,4278680,5721502.04
2011,fire,LOCKPORT TOWNSHIP FPD PENSION FUND,27718356,42378634.31
2011,fire,LOMBARD FIREFIGHTERS PENSION FUND,39296567,54588483
2011,fire,LONG CREEK FPD FIREFIGHTERS PENSION FUND,740038.36,491826.15
2011,fire,LONG GROVE FIREFIGHTERS PENSION FUND,4166634,4571567
2011,fire,LYONS FIREFIGHTERS PENSION FUND,16133.18,305209.84
2011,fire,MACOMB FIREFIGHTERS PENSION FUND,9732045.03,15302079.41
2011,fire,MANTENO COMMUNITY FPD FIREFIGHTERS PENSION FUND,2804740,3930894
2011,fire,MARION FIREFIGHTERS PENSION FUND,7224442.87,10935651.91
2011,fire,MARYVILLE FIREFIGHTER'S PENSION FUND,352775.49,542422.76
2011,fire,MATTESON FIREFIGHTERS PENSION FUND,16794776.85,24505873.28
2011,fire,MATTOON FIREFIGHTERS PENSION FUND,14846724.79,33199377.39
2011,fire,MCCOOK FIREFIGHTERS PENSION FUND,344345,1176627
2011,fire,MELROSE PARK FIREFIGHTERS PENSION FUND,21014009,69624701
2011,fire,MENDOTA FIREFIGHTERS PENSION FUND,1766116.25,2453441.41
2011,fire,METROPOLIS FIREFIGHTERS PENSION FUND,3020048,5112386
2011,fire,MIDLOTHIAN FIREFIGHTERS PENSION FUND,7546609.08,11790311.11
2011,fire,MINOOKA FPD FIREFIGHTERS PENSION FUND,1950136,3144070
2011,fire,MOKENA FPD FIREFIGHTERS PENSION FUND,5141693,6968307
2011,fire,MOLINE FIREFIGHTERS PENSION FUND,27434660,76423850
2011,fire,MONTGOMERY & COUNTRYSIDE FPD FIREFIGHTER'S PENSION,133516,240850
2011,fire,MORTON GROVE FIREFIGHTERS PENSION FUND,24978121,49504332
2011,fire,MT CARMEL FIREFIGHTERS PENSION FUND,1360754.75,1705738.65
2011,fire,MT PROSPECT FIREFIGHTERS PENSION FUND,45726731,81525633
2011,fire,MT VERNON FIREFIGHTERS PENSION FUND,12085425.84,20914176.22
2011,fire,MT ZION FPD FIREFIGHTERS PENSION FUND,832261,957800
2011,fire,NAPERVILLE FIREFIGHTERS PENSION FUND,97476508.23,130367326.7
2011,fire,NEW LENOX FPD FIREFIGHTERS PENSION FUND,1867648,1955126
2011,fire,NEWPORT TOWNSHIP FPD FIREFIGHTERS PENSION FUND,603310.69,702321.36
2011,fire,NILES FIREFIGHTERS PENSION FUND,25888357.09,56445442.39
2011,fire,NORMAL FIREFIGHTERS PENSION FUND,22960598.17,37857102.58
2011,fire,NORTH CHICAGO FIREFIGHTERS PENSION FUND,8722621.98,20299239.61
2011,fire,NORTH MAINE FPD FIREFIGHTERS PENSION FUND,14140730,25593934
2011,fire,NORTH PALOS FPD FIREFIGHTERS PENSION FUND,8964204,13345095
2011,fire,NORTHLAKE FPD FIREFIGHTERS PENSION FUND,10041275.97,12545265.97
2011,fire,NORTHWEST HOMER FPD FIREFIGHTERS PENSION FUND,2515890,4117226
2011,fire,NORTHWEST ST CLAIR COUNTY FPD FIREFIGHTERS PENSION,453643,640392
2011,fire,NORWOOD PARK FPD FIREFIGHTERS PENSION FUND,11159773,21904126
2011,fire,OAK BROOK FIREFIGHTERS PENSION FUND,23010440,38867489
2011,fire,OAK LAWN FIREFIGHTERS PENSION FUND,70901837,109238395
2011,fire,OAK PARK FIREFIGHTERS PENSION FUND,39121138,91448579
2011,fire,OAKBROOK TERRACE FIRE PROTECTION DISTRICT,1271345,2455705
2011,fire,OLNEY FIREFIGHTERS PENSION FUND,2017630.34,2837575.12
2011,fire,ORLAND FPD FIREFIGHTERS PENSION FUND,71588752,91356719
2011,fire,OSWEGO FPD FIREFIGHTERS PENSION FUND,3670900.71,2823585.47
2011,fire,OTTAWA FIREFIGHTERS PENSION FUND,12150367.11,22494397.8
2011,fire,PALATINE FIREFIGHTERS PENSION FUND,48098989,85753341
2011,fire,PALATINE RURAL FPD FIREFIGHTERS PENSION FUND,6702179,8480023
2011,fire,PALOS FPD PENSION FUND,8546540,11374307.57
2011,fire,PALOS HEIGHTS FPD PENSION FUND,6669530,9677425
2011,fire,PARIS FIREFIGHTERS PENSION FUND,4784762.53,8135793.25
2011,fire,PARK FOREST FIREFIGHTERS PENSION FUND,9855330,19257366
2011,fire,PEKIN FIREFIGHTERS PENSION FUND,17850398.85,44905872.86
2011,fire,PEORIA FIREFIGHTERS PENSION FUND,117625072,199564617
2011,fire,PEOTONE FPD FIREFIGHTERS PENSION FUND,888327,651014.37
2011,fire,PERU FIREFIGHTERS PENSION FUND,1758689.44,2306773.56
2011,fire,PLEASANTVIEW FPD,23400143,34194175
2011,fire,PONTIAC FIREFIGHTERS PENSION FUND,3667553.73,5771391.62
2011,fire,PROSPECT HEIGHTS FPD FIREFIGHTERS PENSION FUND,1941852.12,1375441.19
2011,fire,QUINCY FIREFIGHTERS PENSION FUND,22392145.52,54014405.28
2011,fire,RIVER FOREST FIREFIGHTERS PENSION FUND,13785283.48,22929380.57
2011,fire,ROBERTS PARK FPD FIREFIGHTERS PENSION FUND,9716875.8,14726966.06
2011,fire,ROBINSON FIREFIGHTERS PENSION FUND,3235040.45,4116197.32
2011,fire,ROCHELLE FIREFIGHTERS PENSION FUND,7259152,9356391.03
2011,fire,ROCK FALLS FIREFIGHTERS PENSION FUND,5989309.8,7004521.26
2011,fire,ROCK ISLAND FIREFIGHTERS PENSION FUND,23132142.95,55701469.6
2011,fire,ROCKFORD FIREFIGHTERS PENSION FUND,146434569,263643468
2011,fire,ROLLING MEADOWS FIREFIGHTERS PENSION FUND,21736027,54694065
2011,fire,ROSELLE FIREFIGHTERS PENSION FUND,4248393,6357260
2011,fire,SAVANNA FIREFIGHTERS PENSION FUND,1279350.11,1962729.64
2011,fire,SCHAUMBURG FIREFIGHTERS PENSION FUND,82559365.19,132569596.3
2011,fire,SCHILLER PARK FIREFIGHTERS PENSION FUND,9986350.78,18971938.23
2011,fire,SHELBYVILLE FPD FIREFIGHTERS PENSION FUND,912457,2038039
2011,fire,SIGNAL HILL FPD FIREFIGHTERS PENSION FUND,446278,571379
2011,fire,SOUTH BELOIT FIREFIGHTERS PENSION FUND,691450,1969282
2011,fire,SOUTH CHICAGO HEIGHTS FIREFIGHTERS PENSION FUND,88644,360076
2011,fire,SOUTH ELGIN/COUNTRYSIDE FPD FIREFIGHTERS PENSION F,5678355,10340999
2011,fire,SOUTH HOLLAND FIREFIGHTERS PENSION FUND,8777814.4,11502007.47
2011,fire,SPRINGFIELD FIREFIGHTER'S PENSION FUND,91581929.09,212587658.5
2011,fire,ST CHARLES FIREFIGHTERS PENSION FUND,25956318.84,30234204.65
2011,fire,STERLING FIREFIGHTERS PENSION FUND,10974779.08,17320137.86
2011,fire,STREAMWOOD FIREFIGHTERS PENSION FUND,25800713,33788782
2011,fire,STREATOR FIREFIGHTERS PENSION FUND,4435531.34,10111252.71
2011,fire,SUGAR GROVE FPD FIREFIGHTER'S PENSION FUND,1033991.13,625594.72
2011,fire,SULLIVAN FPD FIREFIGHTERS PENSION FUND,2806659,4627109
2011,fire,SWANSEA FIREFIGHTERS PENSION FUND,288007.28,456436.55
2011,fire,SYCAMORE FIREFIGHTERS PENSION FUND,9230948,16545747.61
2011,fire,TAYLORVILLE FIREFIGHTERS PENSION FUND,4538634.64,6482434.25
2011,fire,TRI-STATE FPD FIREFIGHTERS PENSION FUND,22394888,29006183.69
2011,fire,TRI-TOWNSHIP FPD FIREFIGHTERS PENSION FUND,2010726,4987100
2011,fire,UNIVERSITY PARK FIREFIGHTERS PENSION FUND,4677904.31,5334860.06
2011,fire,URBANA FIREFIGHTERS PENSION FUND,30583148,37918292
2011,fire,VILLA PARK FIREFIGHTERS PENSION FUND,13769936.97,18012827.17
2011,fire,WARRENVILLE FPD FIREFIGHTERS PENSION FUND,2366322.65,3020766.86
2011,fire,WAUCONDA FPD FIREFIGHTER'S PENSION FUND,9894530.99,23724145.05
2011,fire,WEST CHICAGO FPD FIREFIGHTERS PENSION FUND,20605948,21155923
2011,fire,WEST FRANKFORT FIREFIGHTERS PENSION FUND,4304321.26,6572170.64
2011,fire,WESTCHESTER FIREFIGHTERS PENSION FUND,17945831.8,25157485.04
2011,fire,WESTERN SPRINGS FIREFIGHTERS PENSION FUND,354524,362015
2011,fire,WHEATON FIREFIGHTERS PENSION FUND,19063032.72,28070318.61
2011,fire,WHEELING FIREFIGHTERS PENSION FUND,28370332,50515561
2011,fire,WILLIAMSON COUNTY FIREFIGHTERS PENSION FUND,462539,423159
2011,fire,WILMETTE FIREFIGHTERS PENSION FUND,34194061,55095483
2011,fire,WILMINGTON FPD FIREFIGHTER'S PENSION FUND,90290.88,120914.24
2011,fire,WIN-BUR-SEW FPD FIREFIGHTERS PENSION FUND,192950.11,123510.07
2011,fire,WINFIELD FPD FIREFIGHTERS PENSION FUND,2674712.81,2403089.72
2011,fire,WINNETKA FIREFIGHTERS PENSION FUND,18842409.89,29713277.45
2011,fire,WOOD DALE FPD FIREFIGHTERS PENSION FUND,10664760,25705068
2011,fire,WOOD RIVER FIREFIGHTERS PENSION FUND,4668905.88,7432278.13
2011,fire,YORK CENTER FIRE PROTECTION DISTRICT,489933,601148
2011,police,ADDISON POLICE PENSION FUND,32264371.03,56036435
2011,police,ALGONQUIN POLICE PENSION FUND,12933532.59,22844209.27
2011,police,ALSIP POLICE PENSION FUND,15120767.73,41289355.8
2011,police,ALTON POLICE PENSION FUND,18097770.88,59543775.77
2011,police,ANNA POLICE PENSION FUND,1789277.88,3706370.57
2011,police,ARLINGTON HEIGHTS POLICE PENSION FUND,77038429.71,112318911.6
2011,police,AURORA POLICE PENSION FUND,136898111,266467215
2011,police,BARRINGTON HILLS POLICE PENSION FUND,5247002,11789179
2011,police,BARRINGTON POLICE PENSION FUND,17519922,29931512
2011,police,BARTLETT POLICE PENSION FUND,23047993,31969148.6
2011,police,BATAVIA POLICE PENSION FUND,22388561,35651014
2011,police,BELLEVILLE POLICE PENSION FUND,29239960.74,57228302.94
2011,police,BELLWOOD POLICE PENSION FUND,26144642,41484582
2011,police,BELVIDERE POLICE PENSION FUND,12905909.09,21394205.59
2011,police,BENSENVILLE POLICE PENSION FUND,13167096,25141886
2011,police,BENTON POLICE PENSION FUND,1717393.24,4107168.61
2011,police,BERKELEY POLICE PENSION FUND,7371932.24,10789879.95
2011,police,BERWYN POLICE PENSION FUND,39925839,82932595
2011,police,BETHALTO POLICE PENSION FUND,5355758,8162957.13
2011,police,BLOOMINGDALE POLICE PENSION FUND,22316260.16,39269438.99
2011,police,BRIDGEVIEW POLICE PENSION FUND,17677631,32474967
2011,police,BROOKFIELD POLICE PENSION FUND,12551748,28853758
2011,police,BUFFALO GROVE POLICE PENSION FUND,45347198,64245153
2011,police,BURBANK POLICE PENSION FUND,30733752,38177646
2011,police,BURR RIDGE POLICE PENSION FUND,11645329,17959573.96
2011,police,CANTON POLICE PENSION FUND,13316914.1,14580439.37
2011,police,CARBONDALE POLICE PENSION FUND,18022809.4,38252875.17
2011,police,CARMI POLICE PENSION FUND,3318804.98,5972709.73
2011,police,CAROL STREAM POLICE PENSION FUND,29963680.32,45126131.12
2011,police,CASEYVILLE POLICE PENSION FUND,2112459,4256394
2011,police,CENTRALIA POLICE PENSION FUND,8826392,18325842
2011,police,CHAMPAIGN POLICE PENSION FUND,63553159,94469326
2011,police,CHATHAM POLICE PENSION FUND,4211877.45,5840970.73
2011,police,CHERRY VALLEY POLICE PENSION FUND,1706459.18,7147585.64
2011,police,CHESTER POLICE PENSION FUND,2202326.26,3293721.09
2011,police,CHICAGO RIDGE POLICE PENSION FUND,13263161,30684605
2011,police,CICERO POLICE PENSION FUND,48934373,95983442
2011,police,CLARENDON HILLS POLICE PENSION FUND,7225798,11373319.31
2011,police,COLLINSVILLE POLICE PENSION FUND,17761823,28356704
2011,police,COLONA POLICE PENSION FUND,1397206.05,2394222.36
2011,police,COLUMBIA POLICE PENSION FUND,4099327.33,5382460.37
2011,police,CRESTWOOD POLICE PENSION FUND,192379,843360.66
2011,police,CRYSTAL LAKE POLICE PENSION FUND,25053121.25,44409259.3
2011,police,DANVILLE POLICE PENSION FUND,17737148.6,48871929.3
2011,police,DECATUR POLICE PENSION FUND,71047779.72,122103104
2011,police,DEERFIELD POLICE PENSION FUND,28613338.54,43070716.27
2011,police,DEKALB POLICE PENSION FUND,24585590,47349862
2011,police,DES PLAINES POLICE PENSION FUND,54943151,115814967
2011,police,DIXON POLICE PENSION FUND,12634989.18,17797717.18
2011,police,DOWNERS GROVE POLICE PENSION FUND,40099540,71495146
2011,police,DUQUOIN POLICE PENSION FUND,3150342,5469490
2011,police,EAST MOLINE POLICE PENSION FUND,16835034.61,27720321.76
2011,police,EAST PEORIA POLICE PENSION FUND,21355766.09,34177481.03
2011,police,EAST ST LOUIS POLICE PENSION FUND,19337171,44915338
2011,police,EDWARDSVILLE POLICE PENSION FUND,13871427.35,21671563.24
2011,police,EFFINGHAM POLICE PENSION FUND,11582928.81,16174070.87
2011,police,ELDORADO POLICE PENSION FUND,1314555.24,1868013.71
2011,police,ELGIN POLICE PENSION FUND,62976197,150152089
2011,police,ELK GROVE VILLAGE POLICE PENSION FUND,53630052,87331112.93
2011,police,ELMWOOD PARK POLICE PENSION FUND,12723521.58,34877048.07
2011,police,EVANSTON POLICE PENSION FUND,75312858,168773178
2011,police,EVERGREEN PARK POLICE PENSION FUND,38818545,50691257
2011,police,FAIRFIELD POLICE PENSION FUND,1871158.68,5399643.56
2011,police,FLOSSMOOR POLICE PENSION FUND,10333105,16544552.97
2011,police,FOREST PARK POLICE PENSION FUND,19483213.27,33065703.96
2011,police,FOX LAKE POLICE PENSION FUND,9358113.53,14183751.95
2011,police,FOX RIVER GROVE POLICE PENSION FUND,1401337.84,5626625.07
2011,police,FRANKFORT POLICE PENSION FUND,6635183.69,14233395.5
2011,police,FRANKLIN PARK POLICE PENSION FUND,20234528.84,45563586.96
2011,police,FREEPORT POLICE PENSION FUND,17482448.29,35265973.01
2011,police,GALESBURG POLICE PENSION FUND,21682195,39284758
2011,police,GENESEO POLICE PENSION FUND,3974874,7556041
2011,police,GENEVA POLICE PENSION FUND,14576219.85,26287284.38
2011,police,GENOA POLICE PENSION FUND,628281.78,2165290.02
2011,police,GILBERTS POLICE PENSION FUND,1063809.46,1273896.53
2011,police,GLEN CARBON POLICE PENSION FUND,3670835.7,4326590.12
2011,police,GLEN ELLYN POLICE PENSION FUND,21747728.41,31261019.74
2011,police,GLENCOE POLICE PENSION FUND,23700436.39,38100168.51
2011,police,GLENDALE HEIGHTS POLICE PENSION FUND,24892753.03,42287686.83
2011,police,GLENVIEW POLICE PENSION FUND,53873596,72642101
2011,police,GLENWOOD POLICE PENSION FUND,5602037.85,12047878.46
2011,police,GRANITE CITY POLICE PENSION FUND,14688898.79,44870761.9
2011,police,GRAYSLAKE POLICE PENSION FUND,10690055.04,14078490.86
2011,police,GREENVILLE POLICE PENSION FUND,2796399,4250030.3
2011,police,HARRISBURG POLICE PENSION FUND,3751569,8280035.44
2011,police,HARVARD POLICE PENSION FUND,6585530,10364519.32
2011,police,HARVEY POLICE PENSION FUND,16917505.19,23949184.98
2011,police,HAWTHORN WOODS POLICE PENSION FUND,1724738,3971286
2011,police,HERRIN POLICE PENSION FUND,3366359.99,9164754.71
2011,police,HICKORY HILLS POLICE PENSION FUND,17284409.25,25183922.84
2011,police,HIGHLAND PARK POLICE PENSION FUND,30051515,62483471
2011,police,HIGHLAND POLICE PENSION FUND,7958372.79,10528632.1
2011,police,HIGHWOOD POLICE PENSION FUND,2061401,2877846.38
2011,police,HILLSBORO POLICE PENSION FUND,865784.25,1664301.65
2011,police,HINSDALE POLICE PENSION FUND,19570477.3,27501904.18
2011,police,HODGKINS POLICE PENSION FUND,8335929,17699466
2011,police,HOFFMAN ESTATES POLICE PENSION FUND,55311312,90000452
2011,police,HUNTLEY POLICE PENSION FUND,3696183,9366129
2011,police,ITASCA POLICE PENSION FUND,12905426.01,22761097.35
2011,police,JACKSONVILLE POLICE PENSION FUND,15364476,23851778
2011,police,JOLIET POLICE PENSION FUND,129803753,241221840
2011,police,JUSTICE POLICE PENSION FUND,8254243,15381019
2011,police,KENILWORTH POLICE PENSION FUND,5645688.96,10013539.64
2011,police,KILDEER POLICE PENSION FUND,2933069.84,6176413.09
2011,police,LAGRANGE PARK POLICE PENSION FUND,11690941.19,21284169
2011,police,LAGRANGE POLICE PENSION FUND,15271390.87,29048496.55
2011,police,LAKE BLUFF POLICE PENSION FUND,7060890.92,12583537.45
2011,police,LAKE IN THE HILLS POLICE PENSION FUND,16707074,20599325
2011,police,LAKE ZURICH POLICE PENSION FUND,10122754.94,28177282.69
2011,police,LANSING POLICE PENSION FUND,26226029.8,59624927.73
2011,police,LASALLE POLICE PENSION FUND,6244480.85,14087048.68
2011,police,LAWRENCEVILLE POLICE PENSION FUND,3349470.06,4197206.92
2011,police,LEMONT POLICE PENSION FUND,9771198,13639694.1
2011,police,LIBERTYVILLE POLICE PENSION FUND,21735877.58,39030837.08
2011,police,LINCOLNSHIRE POLICE PENSION FUND,15659253,18198795
2011,police,LINDENHURST POLICE PENSION FUND,4762884.1,5314535.26
2011,police,LISLE POLICE PENSION FUND,19455741.66,27798831.03
2011,police,LITCHFIELD POLICE PENSION FUND,4172996.26,7276738.05
2011,police,LOCKPORT POLICE PENSION FUND,11730812,19783298
2011,police,LOMBARD POLICE PENSION FUND,43057768,72595502
2011,police,LYONS POLICE PENSION FUND,9819413,21898737
2011,police,MACOMB POLICE PENSION FUND,11278059.34,16833974.5
2011,police,MADISON POLICE PENSION FUND,1598109.96,6626474.86
2011,police,MANHATTAN POLICE PENSION FUND,790208,2376259.47
2011,police,MANTENO POLICE PENSION FUND,3239155.47,3955762.15
2011,police,MARION POLICE PENSION FUND,7762743.94,13283502.27
2011,police,MARYVILLE POLICE PENSION FUND,1246412.77,2497170.53
2011,police,MASCOUTAH POLICE PENSION FUND,2811176.23,4053232.29
2011,police,MATTESON POLICE PENSION FUND,19600032.23,33822725.9
2011,police,MATTOON POLICE PENSION FUND,15004025.55,31709030.99
2011,police,MCCOOK POLICE PENSION FUND,7461305,15718047
2011,police,MCHENRY POLICE PENSION FUND,16827923.55,33508175.54
2011,police,MELROSE PARK POLICE PENSION FUND,21138564,58966669
2011,police,MENDOTA POLICE PENSION FUND,3536403.16,7079745.53
2011,police,METROPOLIS POLICE PENSION FUND,4119569,6988772
2011,police,MIDLOTHIAN POLICE PENSION FUND,11607711.36,15875109.14
2011,police,MILAN POLICE PENSION FUND,5161646.39,8557808.44
2011,police,MOKENA POLICE PENSION FUND,10010114,11863113
2011,police,MOLINE POLICE PENSION FUND,30585304,72163189
2011,police,MONMOUTH POLICE PENSION FUND,5241291.1,10069300.59
2011,police,MONTGOMERY POLICE PENSION FUND,5867333.88,9174036.6
2011,police,MORRIS POLICE PENSION FUND,9572222.13,15570897.93
2011,police,MORTON GROVE POLICE PENSION FUND,28252925,48971447
2011,police,MORTON POLICE PENSION FUND,7964378.18,11109671.21
2011,police,MT CARMEL POLICE PENSION FUND,3577345.53,5693503.91
2011,police,MT PROSPECT POLICE PENSION FUND,46888332,85503868
2011,police,MT VERNON POLICE PENSION FUND,16561191.01,21576524.62
2011,police,MUNDELEIN POLICE PENSION FUND,19968288.25,34261214.7
2011,police,NAPERVILLE POLICE PENSION FUND,97002276.92,142467478.5
2011,police,NEW LENOX POLICE PENSION FUND,11683554.82,19396442.97
2011,police,NILES POLICE PENSION FUND,25509496.36,61351277.69
2011,police,NORMAL POLICE PENSION FUND,25999545.66,46010676.56
2011,police,NORTH AURORA POLICE PENSION FUND,9048601,15312460
2011,police,NORTH CHICAGO POLICE PENSION FUND,16315543.08,38055405.89
2011,police,NORTHFIELD POLICE PENSION FUND,12000995.29,22776711.06
2011,police,NORTHLAKE POLICE PENSION FUND,13615136,22742225
2011,police,OAK BROOK POLICE PENSION FUND,29215128,42592282
2011,police,OAK LAWN POLICE PENSION FUND,70386874,114006986
2011,police,OAK PARK POLICE PENSION FUND,71588497,125650017
2011,police,OAKBROOK TERRACE POLICE PENSION FUND,8558351,15922350.39
2011,police,OGLESBY POLICE PENSION FUND,1984087.71,3884267.85
2011,police,OLNEY POLICE PENSION FUND,3761290.32,7080566.39
2011,police,ORLAND HILLS POLICE PENSION FUND,2330756,3911908.61
2011,police,ORLAND PARK POLICE PENSION FUND,55402834,73348604
2011,police,OSWEGO POLICE PENSION FUND,12944438.34,19037612.32
2011,police,OTTAWA POLICE PENSION FUND,13568020.88,18621615.87
2011,police,PALATINE POLICE PENSION FUND,44974849,81220005
2011,police,PALOS HEIGHTS POLICE PENSION FUND,14165920,28507370
2011,police,PALOS HILLS POLICE PENSION FUND,12791751.07,23863313.33
2011,police,PANA POLICE PENSION FUND,2487262.71,5093953.3
2011,police,PARIS POLICE PENSION FUND,4442064.02,7303713.69
2011,police,PARK FOREST POLICE PENSION FUND,18091670,32751733
2011,police,PARK RIDGE POLICE PENSION FUND,34594933,56120605.72
2011,police,PEORIA POLICE PENSION FUND,143871490,238831010
2011,police,PEOTONE POLICE PENSION FUND,780673.58,2700080.06
2011,police,PERU POLICE PENSION FUND,6321332.29,13890783.2
2011,police,PINCKNEYVILLE POLICE PENSION FUND,457085.81,2431092.85
2011,police,PLANO POLICE PENSION FUND,3310562.23,4666931.91
2011,police,PONTIAC POLICE PENSION FUND,7468277.48,10957227.09
2011,police,PONTOON BEACH POLICE PENSION FUND,2800975.43,6208656.67
2011,police,QUINCY POLICE PENSION FUND,28335557.25,52009169.55
2011,police,RANTOUL POLICE PENSION FUND,13265645.94,20408359.46
2011,police,RIVERSIDE POLICE PENSION FUND,8166806,21280874
