Year,Type,Name,Assets,Liabilities
2005,police,LISLE POLICE PENSION FUND                         ,12525165.96,10846905.53
2005,police,LITCHFIELD POLICE PENSION FUND                    ,3062459.56,1761433.72
2005,police,LOCKPORT POLICE PENSION FUND                      ,7917244.0,7540464.54
2005,police,LOMBARD POLICE PENSION FUND                       ,32090163.98,23855345.22
2005,police,LOVES PARK POLICE PENSION FUND                    ,7698074.6,6773936.21
2005,police,LYNWOOD POLICE PENSION FUND                       ,2086690.44,3018996.09
2005,police,LYONS POLICE PENSION FUND                         ,9064323.03,6124163.17
2005,police,MACOMB POLICE PENSION FUND                        ,9907232.67,4284815.04
2005,police,MADISON POLICE PENSION FUND                       ,1046274.74,2171785.53
2005,police,MANTENO POLICE PENSION FUND                       ,1253737.86,1969330.29
2005,police,MARENGO POLICE PENSION FUND                       ,3073880.59,2623207.54
2005,police,MARION POLICE PENSION FUND                        ,4675851.27,4908029.03
2005,police,MARKHAM POLICE PENSION FUND                       ,10181997.35,7613714.06
2005,police,MARSEILLES POLICE PENSION FUND                    ,1444798.95,1230199.0
2005,police,MASCOUTAH POLICE PENSION FUND                     ,1523227.52,1390042.33
2005,police,MATTESON POLICE PENSION FUND                      ,16255937.98,10390959.08
2005,police,MATTOON POLICE PENSION FUND                       ,12372598.92,7105208.55
2005,police,MAYWOOD POLICE PENSION FUND                       ,11861303.4,15499862.84
2005,police,MCCOOK POLICE PENSION FUND                        ,8568567.54,3955384.85
2005,police,MCHENRY POLICE PENSION FUND                       ,12796338.8,10997247.11
2005,police,MELROSE PARK POLICE PENSION FUND                  ,21832257.53,18985098.97
2005,police,MENDOTA POLICE PENSION FUND                       ,2617554.13,2381552.39
2005,police,METROPOLIS POLICE PENSION FUND                    ,2240270.62,1968234.8
2005,police,MIDLOTHIAN POLICE PENSION FUND                    ,10616281.46,6345036.46
2005,police,MILAN POLICE PENSION FUND                         ,4575262.13,2289094.82
2005,police,MINOOKA POLICE PENSION FUND                       ,889723.1,2158476.52
2005,police,MOKENA POLICE PENSION FUND                        ,4518412.0,5751977.24
2005,police,MOLINE POLICE PENSION FUND                        ,26409539.34,23713499.47
2005,police,MONMOUTH POLICE PENSION FUND                      ,4308229.97,2481898.51
2005,police,MONTGOMERY POLICE PENSION FUND                    ,3709816.0,4305520.89
2005,police,MONTICELLO POLICE PENSION FUND                    ,410064.67,961951.41
2005,police,MORRIS POLICE PENSION FUND                        ,6827927.66,5041620.6
2005,police,MORTON GROVE POLICE PENSION FUND                  ,23510055.63,14684638.16
2005,police,MORTON POLICE PENSION FUND                        ,4614072.47,3544619.41
2005,police,MT CARMEL POLICE PENSION FUND                     ,3030645.14,2024390.62
2005,police,MT PROSPECT POLICE PENSION FUND                   ,37284534.08,28322360.63
2005,police,MT VERNON POLICE PENSION FUND                     ,10422964.3,7248548.77
2005,police,MUNDELEIN POLICE PENSION FUND                     ,13938384.01,9038357.11
2005,police,MURPHYSBORO POLICE PENSION FUND                   ,2964403.36,2140463.11
2005,police,NAPERVILLE POLICE PENSION FUND                    ,53294257.22,57548168.42
2005,police,NEW LENOX POLICE PENSION FUND                     ,6035589.56,6528435.35
2005,police,NILES POLICE PENSION FUND                         ,23728438.78,20601777.97
2005,police,NORMAL POLICE PENSION FUND                        ,17815071.23,13703780.15
2005,police,NORRIDGE POLICE PENSION FUND                      ,13902714.54,13718029.33
2005,police,NORTH AURORA POLICE PENSION FUND                  ,5866735.3,4459519.19
2005,police,NORTH CHICAGO POLICE PENSION FUND                 ,16503531.78,11980092.81
2005,police,NORTH RIVERSIDE POLICE PENSION FUND               ,12410465.96,12587973.8
2005,police,NORTHBROOK POLICE PENSION FUND                    ,35941807.04,19215639.44
2005,police,NORTHFIELD POLICE PENSION FUND                    ,9995363.61,5262210.62
2005,police,NORTHLAKE POLICE PENSION FUND                     ,11429532.64,5607707.21
2005,police,OAK BROOK POLICE PENSION FUND                     ,24826096.0,12369316.7
2005,police,OAK FOREST POLICE PENSION FUND                    ,15635609.97,13068414.2
2005,police,OAK LAWN POLICE PENSION FUND                      ,53349772.29,34575454.38
2005,police,OAK PARK POLICE PENSION FUND                      ,61224165.87,33346754.62
2005,police,OAKBROOK TERRACE POLICE PENSION FUND              ,5779656.0,7888281.18
2005,police,O'FALLON POLICE PENSION FUND                      ,8603946.5,8391868.39
2005,police,OGLESBY POLICE PENSION FUND                       ,1410969.7,1691664.78
2005,police,OLNEY POLICE PENSION FUND                         ,2901335.03,2899626.41
2005,police,OLYMPIA FIELDS POLICE PENSION FUND                ,3467825.58,4146190.5
2005,police,ORLAND HILLS POLICE PENSION FUND                  ,1827070.0,1792703.46
2005,police,ORLAND PARK POLICE PENSION FUND                   ,35542444.36,34699431.03
2005,police,OSWEGO POLICE PENSION FUND                        ,4577758.57,6975662.15
2005,police,OTTAWA POLICE PENSION FUND                        ,10069721.75,4172588.35
2005,police,PALATINE POLICE PENSION FUND                      ,30382993.0,29764248.72
2005,police,PALOS HEIGHTS POLICE PENSION FUND                 ,11661693.27,10275689.33
2005,police,PALOS HILLS POLICE PENSION FUND                   ,8950092.18,9347666.72
2005,police,PALOS PARK POLICE PENSION FUND                    ,425250.0,816494.26
2005,police,PANA POLICE PENSION FUND                          ,2176477.17,1459509.2
2005,police,PARIS POLICE PENSION FUND                         ,3421722.7,2586714.27
2005,police,PARK CITY POLICE PENSION FUND                     ,397975.39,2132005.85
2005,police,PARK FOREST POLICE PENSION FUND                   ,14793719.22,10834844.36
2005,police,PARK RIDGE POLICE PENSION FUND                    ,25557770.81,16031303.75
2005,police,PEKIN POLICE PENSION FUND                         ,17568424.18,11569748.73
2005,police,PEORIA HEIGHTS POLICE PENSION FUND                ,544032.4,715264.24
2005,police,PEORIA POLICE PENSION FUND                        ,123416872.53,69177165.46
2005,police,PERU POLICE PENSION FUND                          ,4490761.98,5377134.55
2005,police,PINCKNEYVILLE POLICE PENSION FUND                 ,203581.0,1076105.38
2005,police,PLAINFIELD POLICE PENSION FUND                    ,4789259.0,6697769.32
2005,police,PLANO POLICE PENSION FUND                         ,1726615.0,1319458.0
2005,police,PONTIAC POLICE PENSION FUND                       ,6345468.67,3561839.58
2005,police,PONTOON BEACH POLICE PENSION FUND                 ,1380347.07,2477761.56
2005,police,POSEN POLICE PENSION FUND                         ,1623002.0,1656550.49
2005,police,PRINCETON POLICE PENSION FUND                     ,4187313.84,2592623.4
2005,police,PROSPECT HEIGHTS POLICE PENSION FUND              ,2886745.53,6921053.74
2005,police,QUINCY POLICE PENSION FUND                        ,22461420.44,15744792.81
2005,police,RANTOUL POLICE PENSION FUND                       ,10241909.0,7270531.7
2005,police,RICHTON PARK POLICE PENSION FUND                  ,7036966.12,5235548.63
2005,police,RIVER FOREST POLICE PENSION FUND                  ,15186710.67,6331541.4
2005,police,RIVER GROVE POLICE PENSION FUND                   ,6696129.43,5230936.06
2005,police,RIVERDALE POLICE PENSION FUND                     ,12182477.46,7488209.14
2005,police,RIVERSIDE POLICE PENSION FUND                     ,8151046.0,6392238.08
2005,police,ROBBINS POLICE PENSION FUND                       ,776833.42,876594.28
2005,police,ROBINSON POLICE PENSION FUND                      ,2128072.09,1490766.75
2005,police,ROCHELLE POLICE PENSION FUND                      ,9544884.71,3273184.27
2005,police,ROCK FALLS POLICE PENSION FUND                    ,5389940.73,3011734.13
2005,police,ROCK ISLAND POLICE PENSION FUND                   ,23300287.38,22260301.48
2005,police,ROCKFORD POLICE PENSION FUND                      ,145902805.56,87704685.35
2005,police,ROCKTON POLICE PENSION FUND                       ,492576.34,1087940.2
2005,police,ROLLING MEADOWS POLICE PENSION FUND               ,19050226.19,20495170.58
2005,police,ROMEOVILLE POLICE PENSION FUND                    ,12165496.22,15001570.52
2005,police,ROSCOE POLICE PENSION FUND                        ,1006301.87,1223077.26
2005,police,ROSELLE POLICE PENSION FUND                       ,12534220.14,12484427.5
2005,police,ROUND LAKE BEACH POLICE PENSION FUND              ,9051617.6,6757246.27
2005,police,ROUND LAKE PARK POLICE PENSION FUND               ,508278.05,1223259.77
2005,police,ROUND LAKE POLICE PENSION FUND                    ,2585482.0,3426008.45
2005,police,SALEM POLICE PENSION FUND                         ,4152499.66,2634886.54
2005,police,SANDWICH POLICE PENSION FUND                      ,2222277.58,1650273.52
2005,police,SAUK VILLAGE POLICE PENSION FUND                  ,4088403.37,3361215.31
2005,police,SAVANNA POLICE PENSION FUND                       ,1522564.46,928243.15
2005,police,SCHAUMBURG POLICE PENSION FUND                    ,56293510.63,48796263.63
2005,police,SCHILLER PARK POLICE PENSION FUND                 ,9995141.05,10490615.7
2005,police,SHELBYVILLE POLICE PENSION FUND                   ,1343645.35,1188649.06
2005,police,SHILOH POLICE PENSION FUND                        ,515839.77,765992.39
2005,police,SHOREWOOD POLICE PENSION FUND                     ,3244082.0,2620078.23
2005,police,SILVIS POLICE PENSION FUND                        ,3416323.41,2552083.46
2005,police,SKOKIE POLICE PENSION FUND                        ,65223597.0,34106540.14
2005,police,SOUTH BARRINGTON POLICE PENSION FUND              ,2379458.8,3292862.45
2005,police,SOUTH BELOIT POLICE PENSION FUND                  ,425234.17,705376.12
2005,police,SOUTH CHICAGO HEIGHTS POLICE PENSION FUND         ,2650711.4,2441688.73
2005,police,SOUTH ELGIN POLICE PENSION FUND                   ,4328359.23,3790982.69
2005,police,SOUTH HOLLAND POLICE PENSION FUND                 ,14625689.18,6638281.99
2005,police,SPRING GROVE POLICE PENSION FUND                  ,773414.76,1563118.64
2005,police,SPRING VALLEY POLICE PENSION FUND                 ,1914238.17,1652294.45
2005,police,SPRINGFIELD POLICE PENSION FUND                   ,79808975.3,60429721.81
2005,police,ST CHARLES POLICE PENSION FUND                    ,19421176.4,14479025.61
2005,police,STAUNTON POLICE PENSION FUND                      ,216738.34,858694.36
2005,police,STEGER POLICE PENSION FUND                        ,3499025.72,2249357.37
2005,police,STERLING POLICE PENSION FUND                      ,9263484.62,8054246.51
2005,police,STICKNEY POLICE PENSION FUND                      ,4314205.92,3480625.1
2005,police,STONE PARK POLICE PENSIONFUND                     ,1207068.18,5283538.38
2005,police,STREAMWOOD POLICE PENSION FUND                    ,21677477.27,15158899.5
2005,police,STREATOR POLICE PENSION FUND                      ,6304220.42,4884058.43
2005,police,SUGAR GROVE POLICE PENSION FUND                   ,247546.26,1026706.04
2005,police,SUMMIT POLICE PENSION FUND                        ,6956894.52,9421595.81
2005,police,SWANSEA POLICE PENSION FUND                       ,3677136.02,4203128.16
2005,police,SYCAMORE POLICE PENSION FUND                      ,5522852.93,6031588.75
2005,police,TAYLORVILLE POLICE PENSION FUND                   ,3768366.3,3088300.01
2005,police,TINLEY PARK POLICE PENSION FUND                   ,28283694.57,24264842.91
2005,police,TROY POLICE PENSION FUND                          ,2700305.34,2936699.64
2005,police,UNIVERSITY PARK POLICEMENS PENSION FUND           ,4444820.31,3025088.22
2005,police,URBANA POLICE PENSION FUND                        ,17176507.83,9580223.4
2005,police,VANDALIA POLICE PENSION FUND                      ,3431021.22,3284374.63
2005,police,VENICE POLICE PENSION FUND                        ,993959.38,236267.4
2005,police,VERNON HILLS POLICE PENSION FUND                  ,17325624.94,16777425.67
2005,police,VILLA PARK POLICE PENSION FUND                    ,20101619.28,16096846.52
2005,police,WARRENVILLE POLICE PENSION FUND                   ,4592487.0,7273192.64
2005,police,WASHINGTON PARK POLICE PENSION FUND               ,2019932.12,1237876.88
2005,police,WASHINGTON POLICE PENSION FUND                    ,4105372.82,2669306.2
2005,police,WATERLOO POLICE PENSION FUND                      ,1611408.0,1539098.26
2005,police,WATSEKA POLICE PENSION FUND                       ,1585445.37,1320907.14
2005,police,WAUCONDA POLICE PENSION FUND                      ,3939869.92,4331205.2
2005,police,WAUKEGAN POLICE PENSION FUND                      ,45338958.9,42507807.31
2005,police,WAYNE POLICE PENSION FUND                         ,555876.0,810571.27
2005,police,WEST CHICAGO POLICE PENSION FUND                  ,10788746.0,11225650.4
2005,police,WEST DUNDEE POLICE PENSION FUND                   ,5503448.84,4804813.31
2005,police,WEST FRANKFORT POLICE PENSION FUND                ,3784561.28,1836083.12
2005,police,WESTCHESTER POLICE PENSION FUND                   ,17667900.38,13650027.15
2005,police,WESTERN SPRINGS POLICE PENSION FUND               ,9783672.0,4994996.96
2005,police,WESTMONT POLICE PENSION FUND                      ,15977920.97,13795973.27
2005,police,WHEATON POLICE PENSION FUND                       ,25611508.76,20921055.87
2005,police,WHEELING POLICE PENSION FUND                      ,23892047.43,20615690.01
2005,police,WILLOW SPRINGS POLICE PENSION FUND                ,285551.29,1317570.09
2005,police,WILLOWBROOK POLICE PENSION FUND                   ,7548153.0,10552653.61
2005,police,WILMETTE POLICE PENSION FUND                      ,24663376.23,16588323.98
2005,police,WILMINGTON POLICE PENSION FUND                    ,1186502.85,2513654.91
2005,police,WINFIELD POLICE PENSION FUND                      ,4822482.5,3694437.99
2005,police,WINNETKA POLICE PENSION FUND                      ,16467137.93,8379955.73
2005,police,WINTHROP HARBOR POLICE PENSION FUND               ,2215459.0,754170.98
2005,police,WOOD DALE POLICE PENSION FUND                     ,12763874.15,10577916.52
2005,police,WOOD RIVER POLICE PENSION FUND                    ,6449220.34,4228406.78
2005,police,WOODRIDGE POLICE PENSION FUND                     ,16005025.55,17977951.86
2005,police,WOODSTOCK POLICE PENSION FUND                     ,9794358.81,8661306.21
2005,police,WORTH POLICE PENSION FUND                         ,8331066.03,4320876.19
2005,police,YORKVILLE POLICE PENSION FUND                     ,1144464.45,4314741.25
2005,police,ZION POLICE PENSION FUND                          ,17999272.75,12749487.56
2006,police,ADDISON POLICE PENSION FUND                       ,28173244.12,21459977.04
2006,police,ALGONQUIN POLICE PENSION FUND                     ,6846476.57,11142980.65
2006,police,ALSIP POLICE PENSION FUND                         ,14030355.03,10104069.29
2006,police,ALTON POLICE PENSION FUND                         ,16397883.21,15136628.44
2006,police,ANNA POLICE PENSION FUND                          ,1411244.11,1173164.51
2006,police,ANTIOCH POLICE PENSION FUND                       ,3503172.61,5367050.83
2006,police,ARLINGTON HEIGHTS POLICE PENSION FUND             ,66460960.63,42001078.24
2006,police,AURORA POLICE PENSION FUND                        ,107142760.94,96035383.3
2006,police,BARRINGTON HILLS POLICE PENSION FUND              ,1329945.23,4202946.79
2006,police,BARRINGTON POLICE PENSION FUND                    ,15713371.16,14502511.84
2006,police,BARTLETT POLICE PENSION FUND                      ,14828205.66,13469603.75
2006,police,BARTONVILLE POLICE PENSION FUND                   ,1582486.5,872459.36
2006,police,BATAVIA POLICE PENSION FUND                       ,15917760.24,15244537.07
2006,police,BEARDSTOWN POLICE PENSION FUND                    ,1364962.58,483703.17
2006,police,BELLEVILLE POLICE PENSION FUND                    ,24129838.34,19249233.8
2006,police,BELLWOOD POLICE PENSION FUND                      ,21408345.0,8962751.54
2006,police,BELVIDERE POLICE PENSION FUND                     ,10671420.69,8190276.63
2006,police,BENSENVILLE POLICE PENSION FUND                   ,12621256.13,6869526.65
2006,police,BENTON POLICE PENSION FUND                        ,1439504.0,336983.98
2006,police,BERKELEY POLICE PENSION FUND                      ,6352424.0,4859498.64
2006,police,BERWYN POLICE PENSION FUND                        ,29465754.52,33417155.06
2006,police,BETHALTO POLICE PENSION FUND                      ,4260419.83,3484067.24
2006,police,BLOOMINGDALE POLICE PENSION FUND                  ,16169771.65,21395793.14
2006,police,BLOOMINGTON POLICE PENSION FUND                   ,38835300.37,34176829.87
2006,police,BLUE ISLAND POLICE PENSION FUND                   ,6833705.64,9436289.53
2006,police,BOLINGBROOK POLICE PENSION FUND                   ,33582931.42,29875294.33
2006,police,BOURBONNAIS POLICE PENSION FUND                   ,6487063.19,5053727.66
2006,police,BRADLEY POLICE PENSION FUND                       ,7851610.42,6599042.26
2006,police,BRAIDWOOD POLICE PENSION FUND                     ,864506.77,1769915.6
2006,police,BRIDGEVIEW POLICE PENSION FUND                    ,12442981.32,14456907.11
2006,police,BROADVIEW POLICE PENSION FUND                     ,17792185.73,12556759.64
2006,police,BROOKFIELD POLICE PENSION FUND                    ,10180516.01,12006343.87
2006,police,BUFFALO GROVE POLICE PENSION FUND                 ,29473062.16,26961524.89
2006,police,BURBANK POLICE PENSION FUND                       ,20154287.3,18563209.44
2006,police,BURNHAM POLICE PENSION FUND                       ,1792197.2,2172229.47
2006,police,BURR RIDGE POLICE PENSION FUND                    ,8261230.0,7839217.8
2006,police,CAHOKIA POLICE PENSION FUND                       ,12382917.32,4928785.89
2006,police,CAIRO POLICE PENSION FUND                         ,1508829.76,1068142.21
2006,police,CALUMET CITY POLICE PENSION FUND                  ,29466569.36,20761224.67
2006,police,CALUMET PARK POLICE PENSION FUND                  ,4923635.84,4093401.29
2006,police,CANTON POLICE PENSION FUND                        ,10594454.47,5902529.86
2006,police,CARBONDALE POLICE PENSION FUND                    ,16571519.37,11964632.21
2006,police,CARLINVILLE POLICE PENSION FUND                   ,2548105.04,2705044.54
2006,police,CARMI POLICE PENSION FUND                         ,2829823.53,2233494.94
2006,police,CAROL STREAM POLICE PENSION FUND                  ,21174590.67,17945503.47
2006,police,CARPENTERSVILLE POLICE PENSION FUND               ,16354593.38,16503793.98
2006,police,CARY POLICE PENSION FUND                          ,3964307.6,5154318.48
2006,police,CASEYVILLE POLICE PENSION FUND                    ,1632824.48,1162897.56
2006,police,CENTRALIA POLICE PENSION FUND                     ,7772794.0,4529100.54
2006,police,CENTREVILLE POLICE PENSION FUND                   ,1569332.07,521975.26
2006,police,CHAMPAIGN POLICE PENSION FUND                     ,50763382.05,26362888.02
2006,police,CHANNAHON POLICE PENSION FUND                     ,2064858.0,3643943.56
2006,police,CHARLESTON POLICE PENSION FUND                    ,9699733.88,6177916.44
2006,police,CHATHAM POLICE PENSION FUND                       ,2279353.02,3736141.61
2006,police,CHERRY VALLEY POLICE PENSION FUND                 ,909902.71,2556627.4
2006,police,CHESTER POLICE PENSION FUND                       ,1633601.99,1190305.4
2006,police,CHICAGO HEIGHTS POLICE PENSION FUND               ,31855537.0,28090746.55
2006,police,CHICAGO RIDGE POLICE PENSION FUND                 ,11249993.24,7596976.39
2006,police,CHILLICOTHE POLICE PENSION FUND                   ,2059063.27,1759418.75
2006,police,CICERO POLICE PENSION FUND                        ,36687734.31,34215452.49
2006,police,CLARENDON HILLS POLICE PENSION FUND               ,5854014.26,3516495.02
2006,police,CLINTON POLICE PENSION FUND                       ,3205392.7,1698818.12
2006,police,COAL CITY POLICE PENSION FUND                     ,365302.3,2352147.87
2006,police,COLLINSVILLE POLICE PENSION FUND                  ,15126733.07,8050675.74
2006,police,COLONA POLICE PENSION FUND                        ,601528.98,1338163.8
2006,police,COLUMBIA POLICE PENSION FUND                      ,2772245.9,1523959.01
2006,police,COUNTRY CLUB HILLS POLICE PENSION FUND            ,8194261.58,6650061.21
2006,police,COUNTRYSIDE POLICE PENSION FUND                   ,12804769.86,8080399.27
2006,police,CREST HILL POLICE PENSION FUND                    ,8201295.0,7465483.61
2006,police,CRESTWOOD POLICE PENSION FUND                     ,421141.64,19633.81
2006,police,CRETE POLICE PENSION FUND                         ,4096948.35,4023724.18
2006,police,CREVE COEUR POLICE PENSION FUND                   ,1619651.91,351357.77
2006,police,CRYSTAL LAKE POLICE PENSION FUND                  ,18189041.59,17692978.16
2006,police,DANVILLE POLICE PENSION FUND                      ,15984626.22,16101849.49
2006,police,DARIEN POLICE PENSION FUND                        ,12248468.85,14177196.57
2006,police,DECATUR POLICE PENSION FUND                       ,56852292.44,43069401.74
2006,police,DEERFIELD POLICE PENSION FUND                     ,23675607.26,13783448.18
2006,police,DEKALB POLICE PENSION FUND                        ,20940415.0,16911531.73
2006,police,DES PLAINES POLICE PENSION FUND                   ,46874130.58,35350243.46
2006,police,DIXON POLICE PENSION FUND                         ,11235913.87,4586830.15
2006,police,DOLTON POLICE PENSION FUND                        ,21206141.11,7542384.47
2006,police,DOWNERS GROVE POLICE PENSION FUND                 ,30370550.89,26037402.34
2006,police,DUQUOIN POLICE PENSION FUND                       ,2934737.04,1751351.87
2006,police,EAST ALTON POLICE PENSION FUND                    ,2701067.7,2178574.98
2006,police,EAST DUNDEE POLICE PENSION FUND                   ,4832616.07,5417097.88
2006,police,EAST MOLINE POLICE PENSION FUND                   ,15546953.58,6268280.06
2006,police,EAST PEORIA POLICE PENSION FUND                   ,17987588.52,8063500.31
2006,police,EAST ST LOUIS POLICE PENSION FUND                 ,16801585.37,14974650.24
2006,police,EDWARDSVILLE POLICE PENSION FUND                  ,10259018.61,8295493.98
2006,police,EFFINGHAM POLICE PENSION FUND                     ,10378910.83,4764687.61
2006,police,ELDORADO POLICE PENSION FUND                      ,1123559.45,635312.8
2006,police,ELGIN POLICE PENSION FUND                         ,53120772.84,55048720.35
2006,police,ELK GROVE VILLAGE POLICE PENSION FUND             ,42247444.0,39545301.24
2006,police,ELMHURST POLICE PENSION FUND                      ,37597040.99,25904330.38
2006,police,ELMWOOD PARK POLICE PENSION FUND                  ,10542600.08,10956438.64
2006,police,EVANSTON POLICE PENSION FUND                      ,58442781.54,43342613.51
2006,police,EVERGREEN PARK POLICE PENSION FUND                ,34174484.9,20736135.74
2006,police,FAIRFIELD POLICE PENSION FUND                     ,1784502.09,1520694.91
2006,police,FAIRVIEW HEIGHTS POLICE PENSION FUND              ,14292907.07,9690995.37
2006,police,FLORA POLICE PENSION FUND                         ,3289127.0,2388946.2
2006,police,FLOSSMOOR POLICE PENSION FUND                     ,8944862.0,4767174.94
2006,police,FOREST PARK POLICE PENSION FUND                   ,17409364.4,9006834.09
2006,police,FOREST VIEW POLICE PENSION FUND                   ,2754783.8,1490077.91
2006,police,FOX LAKE POLICE PENSION FUND                      ,6511707.18,5642668.77
2006,police,FOX RIVER GROVE POLICE PENSION FUND               ,680976.23,2386725.78
2006,police,FRANKFORT POLICE PENSION FUND                     ,4303273.26,3304134.69
2006,police,FRANKLIN PARK POLICE PENSION FUND                 ,17859373.56,15683850.03
2006,police,FREEPORT POLICE PENSION FUND                      ,14881331.75,12099392.7
2006,police,GALESBURG POLICE PENSION FUND                     ,20719718.84,11210193.2
2006,police,GENESEO POLICE PENSION FUND                       ,3746986.13,2561782.54
2006,police,GENEVA POLICE PENSION FUND                        ,12327223.44,12411430.06
2006,police,GILBERTS POLICE PENSION FUND                      ,385119.18,648895.4
2006,police,GLEN CARBON POLICE PENSION FUND                   ,1837734.37,2152501.43
2006,police,GLEN ELLYN POLICE PENSION FUND                    ,17905354.31,8159623.4
2006,police,GLENCOE POLICE PENSION FUND                       ,17117750.24,14850021.71
2006,police,GLENDALE HEIGHTS POLICE PENSION FUND              ,17109805.48,17998432.81
2006,police,GLENVIEW POLICE PENSION FUND                      ,29769086.0,32258247.04
2006,police,GLENWOOD POLICE PENSION FUND                      ,5133049.45,2051481.3
2006,police,GRANITE CITY POLICE PENSION FUND                  ,16331354.12,10353619.78
2006,police,GRAYSLAKE POLICE PENSION FUND                     ,5920787.23,5024947.47
2006,police,GREENVILLE POLICE PENSION FUND                    ,2020140.72,1898954.33
2006,police,GURNEE POLICE PENSION FUND                        ,16127454.24,17380584.55
2006,police,HANOVER PARK POLICE PENSION FUND                  ,14672579.86,11795466.32
2006,police,HARRISBURG POLICE PENSION FUND                    ,2891435.08,2659436.8
2006,police,HARVARD POLICE PENSION FUND                       ,3982442.22,3972426.22
