Year,Type,Fund_Name,Assets,Liabilities
2013,police,MOKENA POLICE PENSION FUND,12899714,15469090
2013,police,MOLINE POLICE PENSION FUND,33824941.39,78649766.56
2013,police,MONEE POLICE PENSION FUND,462485.98,3623019.27
2013,police,MONMOUTH POLICE PENSION FUND,6009949,11587117
2013,police,MONTGOMERY POLICE PENSION FUND,6904157,10935376
2013,police,MONTICELLO POLICE PENSION FUND,837778.06,2824338.37
2013,police,MORRIS POLICE PENSION FUND,10972849,17095503
2013,police,MORTON GROVE POLICE PENSION FUND,30215112.61,55293409.64
2013,police,MORTON POLICE PENSION FUND,9453452,12222288
2013,police,MT CARMEL POLICE PENSION FUND,3762726,7052594
2013,police,MT PROSPECT POLICE PENSION FUND,52667501.54,94373590.75
2013,police,MT VERNON POLICE PENSION FUND,16208874,23460415
2013,police,MT ZION POLICE PENSION FUND,292226,1480047
2013,police,MUNDELEIN POLICE PENSION FUND,22591438,36571614
2013,police,MURPHYSBORO POLICE PENSION FUND,4888030,9757311
2013,police,NAPERVILLE POLICE PENSION FUND,115366130,158705871
2013,police,NEW LENOX POLICE PENSION FUND,14017015,21755655
2013,police,NILES POLICE PENSION FUND,27386123,68727683
2013,police,NORMAL POLICE PENSION FUND,28850685,52210958
2013,police,NORRIDGE POLICE PENSION FUND,22344022,37850788
2013,police,NORTH AURORA POLICE PENSION FUND,10806275,17314947
2013,police,NORTH CHICAGO POLICE PENSION FUND,17599507,42360474
2013,police,NORTH RIVERSIDE POLICE PENSION FUND,14550010,33022953
2013,police,NORTHBROOK POLICE PENSION FUND,41589996,72448303
2013,police,NORTHFIELD POLICE PENSION FUND,13565454,24412134
2013,police,NORTHLAKE POLICE PENSION FUND,15304408.16,25514512.24
2013,police,OAK BROOK POLICE PENSION FUND,31845978.62,47345492.15
2013,police,OAK FOREST POLICE PENSION FUND,23686168,37721515
2013,police,OAK LAWN POLICE PENSION FUND,72867624.25,125167246.9
2013,police,OAK PARK POLICE PENSION FUND,79159068.33,138132013.5
2013,police,OAKBROOK TERRACE POLICE PENSION FUND,9171132,18899891
2013,police,O'FALLON POLICE PENSION FUND,20597835,24995214
2013,police,OGLESBY POLICE PENSION FUND,2426538,6252341
2013,police,OLNEY POLICE PENSION FUND,4034755,9753340
2013,police,OLYMPIA FIELDS POLICE PENSION FUND,7014795,17391574
2013,police,ORLAND HILLS POLICE PENSION FUND,2775606,5301637
2013,police,ORLAND PARK POLICE PENSION FUND,64888885.28,86918756.29
2013,police,OSWEGO POLICE PENSION FUND,16839536,21486898
2013,police,OTTAWA POLICE PENSION FUND,15558257,21075984
2013,police,PALATINE POLICE PENSION FUND,54774090.26,94960424.36
2013,police,PALOS HEIGHTS POLICE PENSION FUND,15710441.16,32266612.99
2013,police,PALOS HILLS POLICE PENSION FUND,14483473.47,26909788.7
2013,police,PALOS PARK POLICE PENSION FUND,2008240,5229853
2013,police,PANA POLICE PENSION FUND,2703669,6033264
2013,police,PARIS POLICE PENSION FUND,5057294,8995447
2013,police,PARK CITY POLICE PENSION FUND,1075300,5679090
2013,police,PARK FOREST POLICE PENSION FUND,19441873.03,36438042.49
2013,police,PARK RIDGE POLICE PENSION FUND,38663096,60419182
2013,police,PEKIN POLICE PENSION FUND,25612013.66,43572257.02
2013,police,PEORIA HEIGHTS POLICE PENSION FUND,1701522,3908455
2013,police,PEORIA POLICE PENSION FUND,155489857.6,261175450.5
2013,police,PEOTONE POLICE PENSION FUND,1044904,4165313
2013,police,PERU POLICE PENSION FUND,7261539,16046093
2013,police,PINCKNEYVILLE POLICE PENSION FUND,501989,3483597
2013,police,PLAINFIELD POLICE PENSION FUND,18905339,21883606
2013,police,PLANO POLICE PENSION FUND,3785287,5821504
2013,police,PONTIAC POLICE PENSION FUND,8384289,11769127
2013,police,PONTOON BEACH POLICE PENSION FUND,3475169,7985866
2013,police,POSEN POLICE PENSION FUND,3165721,4525766
2013,police,PRINCETON POLICE PENSION FUND,6336543,7943804
2013,police,PROSPECT HEIGHTS POLICE PENSION FUND,11070681,15575969
2013,police,QUINCY POLICE PENSION FUND,31735163,56473746
2013,police,RANTOUL POLICE PENSION FUND,15242763,21691790
2013,police,RICHTON PARK POLICE PENSION FUND,11811278,19871902
2013,police,RIVER FOREST POLICE PENSION FUND,19985726,35364177
2013,police,RIVER GROVE POLICE PENSION FUND,7120642,19750242
2013,police,RIVERDALE POLICE PENSION FUND,14472026,31372107
2013,police,RIVERSIDE POLICE PENSION FUND,8500312.75,22120603.88
2013,police,ROBBINS POLICE PENSION FUND,838039,1446745
2013,police,ROBINSON POLICE PENSION FUND,3752598,5226691
2013,police,ROCHELLE POLICE PENSION FUND,11280206,13896444
2013,police,ROCK FALLS POLICE PENSION FUND,6918819,11584756
2013,police,ROCK ISLAND POLICE PENSION FUND,31739329,74276441
2013,police,ROCKFORD POLICE PENSION FUND,171294418.7,288483920.5
2013,police,ROCKTON POLICE PENSION FUND,2719869,4067890
2013,police,ROLLING MEADOWS POLICE PENSION FUND,31522278.91,63550981.82
2013,police,ROMEOVILLE POLICE PENSION FUND,27998706,41435431
2013,police,ROSCOE POLICE PENSION FUND,2573804.34,5002608.77
2013,police,ROSELLE POLICE PENSION FUND,20683955.43,35279261.34
2013,police,ROUND LAKE BEACH POLICE PENSION FUND,15793018,24960643
2013,police,ROUND LAKE PARK POLICE PENSION FUND,1508326,6634932
2013,police,ROUND LAKE POLICE PENSION FUND,5144082,8915594
2013,police,SALEM POLICE PENSION FUND,5222301,9309613
2013,police,SANDWICH POLICE PENSION FUND,3437446,7555960
2013,police,SAUK VILLAGE POLICE PENSION FUND,5764268,11558316
2013,police,SAVANNA POLICE PENSION FUND,2026580,3725221
2013,police,SCHAUMBURG POLICE PENSION FUND,87918706,148911808
2013,police,SCHILLER PARK POLICE PENSION FUND,15700922,33679774
2013,police,SHELBYVILLE POLICE PENSION FUND,2048028,4087447
2013,police,SHILOH POLICE PENSION FUND,2952177,3844766
2013,police,SHOREWOOD POLICE PENSION FUND,9271092,10856107
2013,police,SILVIS POLICE PENSION FUND,5556122,10000932
2013,police,SKOKIE POLICE PENSION FUND,77365214.87,121562275.8
2013,police,SOUTH BARRINGTON POLICE PENSION FUND,6773258,11163071
2013,police,SOUTH BELOIT POLICE PENSION FUND,1993211,4493339
2013,police,SOUTH CHICAGO HEIGHTS POLICE PENSION FUND,3590402.78,5809855.01
2013,police,SOUTH ELGIN POLICE PENSION FUND,10779103,18202140
2013,police,SOUTH HOLLAND POLICE PENSION FUND,20511425,31433065
2013,police,SPRING GROVE POLICE PENSION FUND,1907539,5239963
2013,police,SPRING VALLEY POLICE PENSION FUND,3434752,4024927
2013,police,SPRINGFIELD POLICE PENSION FUND,123887066,239914513
2013,police,ST CHARLES POLICE PENSION FUND,28796811,48227150
2013,police,STAUNTON POLICE PENSION FUND,671475,2023351
2013,police,STEGER POLICE PENSION FUND,5517869,7012012
2013,police,STERLING POLICE PENSION FUND,12252575,20157143
2013,police,STICKNEY POLICE PENSION FUND,5270170,15415178
2013,police,STONE PARK POLICE PENSIONFUND,1153492,18149569
2013,police,STREAMWOOD POLICE PENSION FUND,37322123.31,51738683.77
2013,police,STREATOR POLICE PENSION FUND,8846376,17325352
2013,police,SUGAR GROVE POLICE PENSION FUND,2424653,6802460
2013,police,SUMMIT POLICE PENSION FUND,8303825.67,26402921.02
2013,police,SWANSEA POLICE PENSION FUND,7529456,12564710
2013,police,SYCAMORE POLICE PENSION FUND,10467939,15342554
2013,police,TAYLORVILLE POLICE PENSION FUND,5991680,9621110
2013,police,TINLEY PARK POLICE PENSION FUND,50648361,69742518
2013,police,TROY POLICE PENSION FUND,6499034,7985212
2013,police,UNIVERSITY PARK POLICEMENS PENSION FUND,6302246,10127353
2013,police,URBANA POLICE PENSION FUND,30696879,41708694
2013,police,VANDALIA POLICE PENSION FUND,4588540,6533703
2013,police,VENICE POLICE PENSION FUND,537286,1737263
2013,police,VERNON HILLS POLICE PENSION FUND,33054028,41767322
2013,police,VILLA PARK POLICE PENSION FUND,24871039,43038446
2013,police,WARRENVILLE POLICE PENSION FUND,13023232,18320660
2013,police,WASHINGTON PARK POLICE PENSION FUND,2085435.16,3528740.68
2013,police,WASHINGTON POLICE PENSION FUND,6418002,10131252
2013,police,WATERLOO POLICE PENSION FUND,3879145,7047176
2013,police,WATSEKA POLICE PENSION FUND,2073940,8477714
2013,police,WAUCONDA POLICE PENSION FUND,9037188,16782092
2013,police,WAUKEGAN POLICE PENSION FUND,66399147,149076440
2013,police,WAYNE POLICE PENSION FUND,1403184,3798326
2013,police,WEST CHICAGO POLICE PENSION FUND,22609438.36,38554979.16
2013,police,WEST DUNDEE POLICE PENSION FUND,9520245,15799117
2013,police,WEST FRANKFORT POLICE PENSION FUND,4650622,9394048
2013,police,WESTCHESTER POLICE PENSION FUND,24246504,37559406
2013,police,WESTERN SPRINGS POLICE PENSION FUND,12790961.06,22306552.1
2013,police,WESTMONT POLICE PENSION FUND,23166848,50590084
2013,police,WHEATON POLICE PENSION FUND,42471171,66486523
2013,police,WHEELING POLICE PENSION FUND,40799660.93,61840944.12
2013,police,WILLOW SPRINGS POLICE PENSION FUND,952889,8637670
2013,police,WILLOWBROOK POLICE PENSION FUND,16614601,23370590
2013,police,WILMETTE POLICE PENSION FUND,37997446.23,55396963.52
2013,police,WILMINGTON POLICE PENSION FUND,3956082,7213264
2013,police,WINFIELD POLICE PENSION FUND,6986515,13841328
2013,police,WINNETKA POLICE PENSION FUND,23446190.78,33464226.68
2013,police,WINTHROP HARBOR POLICE PENSION FUND,3347667,3483169
2013,police,WOOD DALE POLICE PENSION FUND,19390947,31429669
2013,police,WOOD RIVER POLICE PENSION FUND,8880518,14739081
2013,police,WOODRIDGE POLICE PENSION FUND,28147771,53196859
2013,police,WOODSTOCK POLICE PENSION FUND,17554635,26743628
2013,police,WORTH POLICE PENSION FUND,10017831,22933401
2013,police,YORKVILLE POLICE PENSION FUND,5127259,12523643
2013,police,ZION POLICE PENSION FUND,25985055,40595288
2014,fire,ADDISON FIREFIGHTERS PENSION FUND,41708252.32,67244700.29
2014,fire,ALGONQUIN LAKE IN THE HILLS FPD PENSION FUND,16348995.47,21724013.47
2014,fire,ALSIP FIREFIGHTERS PENSION FUND,21534721.42,38349393.43
2014,fire,ALTON FIREFIGHTERS PENSION FUND,19283660.26,63230835.92
2014,fire,ANNA FIREFIGHTERS PENSION FUND,1899027.82,3946368.54
2014,fire,ARLINGTON HEIGHTS FIREFIGHTERS PENSION FUND,81668367.26,125752382.2
2014,fire,ATWOOD FPD FIREFIGHTERS PENSION FUND,0,0
2014,fire,AURORA FIREFIGHTERS PENSION FUND,136517946.1,255089344.6
2014,fire,BARRINGTON FIREFIGHTERS PENSION FUND,14736044.53,16207681.62
2014,fire,BARTLETT FPD FIREFIGHTERS PENSION FUND,13570933.67,20619938.13
2014,fire,BATAVIA FIREFIGHTERS PENSION FUND,13591204.8,19844581.04
2014,fire,BEACH PARK FPD FIREFIGHTERS PENSION FUND,821478.83,1506785.71
2014,fire,BEARDSTOWN FIREFIGHTERS PENSION FUND,881035.06,1551410
2014,fire,BELLEVILLE FIREFIGHTERS PENSION FUND,23523929.18,56572461.98
2014,fire,BELLWOOD FIREFIGHTERS PENSION FUND,21742731.2,33975309.33
2014,fire,BELVIDERE FIREFIGHTERS PENSION FUND,13361471.14,21688964.78
2014,fire,BEMENT FPD FIREFIGHTERS PENSION FUND,255454.57,779115.11
2014,fire,BENSENVILLE FIREFIGHTERS PENSION FUND,10409306.69,27264575.08
2014,fire,BENTON FIREFIGHTERS PENSION FUND,3567417.82,4197680.62
2014,fire,BERWYN FIREFIGHTERS PENSION FUND,37777755.95,83479777.46
2014,fire,BLOOMINGDALE FPD FIREFIGHTERS PENSION FUND,26029772.71,40094779.01
2014,fire,BLOOMINGTON FIREFIGHTERS PENSION FUND,45910482.67,97041141.81
2014,fire,BLUE ISLAND FIREFIGHTERS PENSION FUND,6052519.35,20036938.56
2014,fire,BOLINGBROOK FIREFIGHTERS PENSION FUND,44804569.39,83052910.16
2014,fire,BOURBONNAIS FPD FIREFIGHTERS PENSION FUND,1563847.19,2480322.29
2014,fire,BRADLEY FIREFIGHTERS PENSION FUND,563948,1414063.3
2014,fire,BRIDGEVIEW FIREFIGHTERS PENSION FUND,22052148.41,42174066.29
2014,fire,BRISTOL-KENDALL  FIREFIGHTER'S PENSION FUND,219249.41,272330.63
2014,fire,BROADVIEW FIREFIGHTERS PENSION FUND,19656462.34,36165274.68
2014,fire,BROOKFIELD FIREFIGHTERS PENSION FUND,13525273.73,20915736.13
2014,fire,BUFFALO GROVE FIREFIGHTERS PENSION FUND,48220709.04,64448574.49
2014,fire,BURBANK FIREFIGHTERS PENSION FUND,23942210.66,31154782.94
2014,fire,BURLINGTON COMMUNITY FPD FIREFIGHTERS' PENSION FUN,234651.77,510444.01
2014,fire,BYRON FPD FIREFIGHTERS PENSION FUND,10654928.48,11753535.83
2014,fire,CAIRO FIREFIGHTERS PENSION FUND,522207.48,3669581.31
2014,fire,CALUMET CITY FIREFIGHTERS PENSION FUND,30979100.59,61096349.19
2014,fire,CANTON FIREFIGHTERS PENSION FUND,7043835.5,15972812.05
2014,fire,CARBONDALE FIREFIGHTERS PENSION FUND,13537505.16,26068873.15
2014,fire,CARBONDALE TOWNSHIP FIREFIGHTERS PENSION FUND,1019140.51,793984.1
2014,fire,CAROL STREAM FPD FIREFIGHTERS PENSION FUND,32362203.05,43865752.74
2014,fire,CARPENTERSVILLE FIREFIGHTERS PENSION FUND,17269413.67,24208166.06
2014,fire,CARTERVILLE FIREFIGHTER'S PENSION FUND,313757.79,834879.29
2014,fire,CARY FPD FIREFIGHTERS PENSION FUND,3343830.8,4164421.34
2014,fire,CENTRAL STICKNEY FPD FIREFIGHTERS PENSION FUND,9295.95,0
2014,fire,CENTRALIA FIREFIGHTERS PENSION FUND,11223121.62,17296616.95
2014,fire,CENTRALIA FPD FIREFIGHTERS PENSION FUND,473417.47,759841.94
2014,fire,CHAMPAIGN FIREFIGHTERS PENSION FUND,70885555.36,92304228.06
2014,fire,CHANNAHON FIRE PROTECTION DISTRICT FIREFIGHTERS PE,3799509.48,2734515.43
2014,fire,CHARLESTON FIREFIGHTERS PENSION FUND,13521560.13,28226804.09
2014,fire,CHATHAM FPD FIREFIGHTER'S PENSION FUND,2184886.12,4098563.6
2014,fire,CHERRY VALLEY FPD FIREFIGHTER'S PENSION FUND,2409151.53,3930890.59
2014,fire,CHICAGO HEIGHTS FIREFIGHTERS PENSION FUND,34738941.03,73147541.7
2014,fire,CHICAGO RIDGE FIREFIGHTERS PENSION FUND,10387628.81,16603668.96
2014,fire,CICERO FIREFIGHTERS PENSION FUND,29728344.43,95554143.91
2014,fire,CLARENDON HILLS FIREFIGHTERS PENSION FUND,1086237.22,1578199.76
2014,fire,CLINTON FIREFIGHTERS PENSION FUND,1616586.79,2605194.74
2014,fire,COAL CITY FIREFIGHTER'S PENSION FUND,720216.82,888285.17
2014,fire,COLLINSVILLE FIREFIGHTERS PENSION FUND,20917874.81,27621579.52
2014,fire,COUNTRY CLUB HILLS  FIREFIGHTERS PENSION FUND,6783354.62,12580204.69
2014,fire,COUNTRYSIDE FPD FIREFIGHTERS  PENSION FUND,23664262.95,33570735.92
2014,fire,CRYSTAL LAKE FIREFIGHTERS PENSION FUND,24882348.87,36799670.4
2014,fire,DANVILLE FIREFIGHTERS PENSION FUND,12869374.99,57420379.15
2014,fire,DARIEN WOODRIDGE FPD FIREFIGHTERS PENSION FUND,17506963.52,26270117.23
2014,fire,DECATUR FIREFIGHTERS PENSION FUND,70190349.62,125760875.5
2014,fire,DEERFIELD-BANNOCKBURN FIRE PROTECTION DISTRICT,32483609.85,41155807.76
2014,fire,DEKALB FIREFIGHTERS PENSION FUND,23459878.33,62913717.9
2014,fire,DES PLAINES FIREFIGHTERS PENSION FUND,68110763.21,127830759.4
2014,fire,DIXON COMMUNITY FPD FIREFIGHTER PENSION FUND,4384267.9,7689822.62
2014,fire,DIXON FIREFIGHTERS PENSION FUND,8413398.64,15357589.03
2014,fire,DOLTON FIREFIGHTERS PENSION FUND,12222770.16,16967094.62
2014,fire,DOWNERS GROVE FIREFIGHTERS PENSION FUND,44327037.84,81316077.36
2014,fire,DUQUOIN FIREFIGHTERS PENSION FUND,2659733.38,6153133.11
2014,fire,EAST ALTON FIREFIGHTERS PENSION FUND,1823654.5,6352464.43
2014,fire,EAST DUNDEE/COUNTRYSIDE FPD FIREFIGHTERS PENSION F,2267064.75,3889477.3
2014,fire,EAST JOLIET FPD FIREFIGHTERS PENSION FUND,2077573.22,1601107.05
2014,fire,EAST MOLINE FIREFIGHTERS PENSION FUND,23469474.17,30987831.19
2014,fire,EAST PEORIA FIREFIGHTERS PENSION FUND,19365812.64,32485849.1
2014,fire,EAST ST LOUIS FIREFIGHTERS PENSION FUND,12174955.75,55020983.87
2014,fire,EDWARDSVILLE FIREFIGHTERS PENSION FUND,12471998.28,19478571.04
2014,fire,EFFINGHAM FIREFIGHTERS PENSION FUND,8737896.97,13631847.69
2014,fire,ELBURN/COUNTRYSIDE FPD FIREFIGHTERS PENSION FUND,5107133.4,7441376.72
2014,fire,ELGIN FIREFIGHTERS PENSION FUND,64335887.72,139877452.4
2014,fire,ELK GROVE VILLAGE FIREFIGHTERS PENSION FUND,60070751.3,109109265.4
2014,fire,ELMHURST FIREFIGHTERS PENSION FUND,36049952.07,53941239.25
2014,fire,ELMWOOD PARK FIREFIGHTERS PENSION FUND,12982693.37,31206254.72
2014,fire,ELWOOD FIRE PROTECTION DISTRICT,1005676.84,1285815.04
2014,fire,EVANSTON FIREFIGHTERS PENSION FUND,67907517.32,144728429.8
2014,fire,EVERGREEN PARK FIREFIGHTERS PENSION FUND,783039.38,3325088.89
2014,fire,FAIRFIELD FIREFIGHTERS PENSION FUND,1674567.86,3386370.9
2014,fire,FAIRVIEW/CASEYVILLE FPD FIREFIGHTERS  PENSION FUND,2248083.42,3167243.83
2014,fire,FLOSSMOOR FIREFIGHTERS PENSION FUND,2144601.67,5430297.8
2014,fire,FOREST PARK FIREFIGHTERS PENSION FUND,14555263.41,30495174.75
2014,fire,FOREST VIEW FIREFIGHTERS PENSION FUND,2111130.67,5885339.52
2014,fire,FOSTERBURG FPD FIREFIGHTERS PENSION FUND,1243229.62,2011932.05
2014,fire,FOX LAKE FIREFIGHTERS PENSION FUND,216777.24,0
2014,fire,FOX LAKE FIREFIGHTERS PENSION FUND,546312.95,760640.44
2014,fire,FOX RIVER GROVE FPD FIREFIGHTERS PENSION FUND,5878.9,0
2014,fire,FRANKFORT FPD FIREFIGHTERS PENSION FUND,10571597.36,13004771.52
2014,fire,FRANKLIN PARK FIREFIGHTERS PENSION FUND,24072923.86,50074001.74
2014,fire,FREEPORT FIREFIGHTERS PENSION FUND,32359610.56,43839358.27
2014,fire,GALESBURG FIRE FIGHTERS PENSION FUND,21684863.2,46002276.8
2014,fire,GENEVA FIREFIGHTERS PENSION FUND,12725067.11,15804351.87
2014,fire,GLENCOE FIREFIGHTERS PENSION FUND,14622.59,731877.86
2014,fire,GLENSIDE FPD FIREFIGHTERS PENSION FUND,8202295.7,16031552.49
2014,fire,GLENVIEW FIREFIGHTERS PENSION FUND,62880673.16,109216618.1
2014,fire,GLENWOOD FIREFIGHTERS PENSION FUND,2581247.28,4652678.07
2014,fire,GODFREY PAID FIREFIGHTERS PENSION FUND,6617292.74,9229153.18
2014,fire,GRANITE CITY FIREFIGHTERS PENSION FUND C/O GAIL VA,16798775.06,54510463.14
2014,fire,GRAYSLAKE FPD FIREFIGHTERS PENSION FUND,12222439.29,19406565.27
2014,fire,GREATER ROUND LAKE FPD FIREFIGHTERS PENSION FUND,14301252.32,17896528.34
2014,fire,GURNEE FIREFIGHTERS PENSION FUND,25736714.86,35668633.94
2014,fire,HAMPSHIRE FPD FIREFIGHTERS PENSION FUND,1774707.92,2757785.07
2014,fire,HANOVER PARK FIREFIGHTERS PENSION FUND,15607705.07,25213633.61
2014,fire,HARLEM-ROSCOE FIREFIGHTERS PENSION FUND,164166.82,201228.1
2014,fire,HARRISBURG FIREFIGHTERS PENSION FUND,3436309.87,5264485.89
2014,fire,HARVARD FPD PENSION FUND,92375.25,0
2014,fire,HARVEY FIREFIGHTERS PENSION FUND,12006534.27,42751013.08
2014,fire,HAZEL CREST FIREFIGHTERS PENSION FUND,7147023.01,9906207.79
2014,fire,HERRIN FIREFIGHTERS PENSION FUND,6761878.28,12388635.89
2014,fire,HIGHLAND PARK FIREFIGHTERS PENSION FUND,34312863.19,69560168.83
2014,fire,HIGHWOOD FIREFIGHTERS PENSION FUND,3133239.02,3563350.45
2014,fire,HILLSBORO FIREFIGHTER'S PENSION FUND,782342.22,1546401.52
2014,fire,HILLSIDE FIREFIGHTERS PENSION FUND,10617489.1,23014590.85
2014,fire,HINCKLEY COMMUNITY FPD FIREFIGHTER'S PENSION FUND,31683.33,109205.79
2014,fire,HINSDALE FIREFIGHTERS PENSION FUND,15948781.42,27076920.95
2014,fire,HOFFMAN ESTATES FIREFIGHTERS PENSION FUND,69504974.3,105077648.8
2014,fire,HOMER TOWNSHIP FPD FIREFIGHTERS PENSION FUND,8427344.79,10194244.74
2014,fire,HOMEWOOD FIREFIGHTERS PENSION FUND,11278274.52,16729573.12
2014,fire,HUNTLEY FPD FIREFIGHTERS PENSION FUND,18142875.03,20197938.22
2014,fire,ITASCA FPD #1 FIREFIGHTERS PENSION FUND,10189027.06,16624741.04
2014,fire,IVESDALE FPD FIREFIGHTERS PENSION FUND,120809.36,274681.66
2014,fire,JACKSONVILLE FIREFIGHTERS PENSION FUND,17135576.24,24221256.28
2014,fire,JEFFERSON FPD FIREFIGHTERS PENSION FUND,1436336.66,2724653.89
2014,fire,JERSEYVILLE FIREFIGHTER'S PENSION FUND,179072,256074.65
2014,fire,JOLIET FIREFIGHTERS PENSION FUND,114065729.4,231131952.5
2014,fire,JUSTICE FIREFIGHTERS PENSION FUND,238640.56,929174.87
2014,fire,KANKAKEE FIREFIGHTERS PENSION FUND,10273795.59,53748594.81
2014,fire,KEWANEE COMMUNITY FPD FIREFIGHTERS PENSION FUND,433232.24,1108434.13
2014,fire,KEWANEE FIREFIGHTERS PENSION FUND,8379112.31,14090806.37
2014,fire,LAGRANGE FIREFIGHTERS PENSION FUND,9749747.99,24223885.91
2014,fire,LAKE EGYPT FPD FIREFIGHTERS PENSION FUND,1238843.23,1397298.85
2014,fire,LAKE FOREST FIREFIGHTERS PENSION FUND,30415551.25,41837088.34
2014,fire,LAKE VILLA FPD FIREFIGHTER'S PENSION FUND,331872.21,0
2014,fire,LAKE ZURICH FIREFIGHTERS PENSION FUND,21936127.49,39695002.62
2014,fire,LANSING FIREFIGHTERS PENSION FUND,12165106.44,22391627.45
2014,fire,LASALLE FIREFIGHTERS PENSION FUND,1616534.48,3232121.4
2014,fire,LEMONT FPD FIREFIGHTERS PENSION FUND,21121367.8,31278470.35
2014,fire,LEYDEN FPD FIREFIGHTERS PENSION FUND,6008779.99,14374684.95
2014,fire,LIBERTYVILLE FIREFIGHTERS PENSION FUND,22454427.7,34573171.02
2014,fire,LINCOLN FIREFIGHTERS PENSION FUND,6004387.39,17453375.53
2014,fire,LINCOLN RURAL FPD FIREFIGHTERS PENSION FUND,3550617.07,4057506.6
2014,fire,LINCOLNSHIRE-RIVERWOOD FPD FIREFIGHTERS PENSION FU,28517387.81,33783410.48
2014,fire,LISLE-WOODRIDGE FPD FIREFIGHTERS PENSION FUND,54653964.25,111922476.2
2014,fire,LITCHFIELD FIREFIGHTERS PENSION FUND,4836145.37,7259085.28
2014,fire,LOCKPORT TOWNSHIP FPD PENSION FUND,35975993.94,56964708.71
2014,fire,LOMBARD FIREFIGHTERS PENSION FUND,51882423.86,67334359.45
2014,fire,LONG CREEK FPD FIREFIGHTERS PENSION FUND,708260.55,781192.37
2014,fire,LONG GROVE FIREFIGHTERS PENSION FUND,8131214.66,8344301.6
2014,fire,LYONS FIREFIGHTERS PENSION FUND,5088.82,378345.91
2014,fire,MACOMB FIREFIGHTERS PENSION FUND,10493675.6,17575371.13
2014,fire,MANHATTAN FPD FIREFIGHTER'S PENSION FUND,774380.46,1321861.06
2014,fire,MANTENO COMMUNITY FPD FIREFIGHTERS PENSION FUND,4085760.13,4748672.44
2014,fire,MARION FIREFIGHTERS PENSION FUND,9099492.25,13721360.23
2014,fire,MARKHAM FIREFIGHTERS PENSION FUND,5947963.41,8305654.88
2014,fire,MARYVILLE FIREFIGHTER'S PENSION FUND,608432.11,1347756.13
2014,fire,MATTESON FIREFIGHTERS PENSION FUND,19578417.5,32325587.93
2014,fire,MATTOON FIREFIGHTERS PENSION FUND,16160232.36,37192774.14
2014,fire,MAYWOOD FIREFIGHTERS PENSION FUND,15789976.8,42868276.64
2014,fire,MCCOOK FIREFIGHTERS PENSION FUND,573888.92,1205804.55
2014,fire,MCHENRY TOWNSHIP FIREFIGHTERS PENSION FUND,3747186.69,214749.92
2014,fire,MELROSE PARK FIREFIGHTERS PENSION FUND,18737969.61,76266635.22
2014,fire,MENDOTA FIREFIGHTERS PENSION FUND,2383492.97,4299473.06
2014,fire,METROPOLIS FIREFIGHTERS PENSION FUND,3688361.97,6675441.29
2014,fire,MIDLOTHIAN FIREFIGHTERS PENSION FUND,8121825.91,14619607.51
2014,fire,MINOOKA FPD FIREFIGHTERS PENSION FUND,3086002.22,2654418.49
2014,fire,MOKENA FPD FIREFIGHTERS PENSION FUND,8828193.26,12302700.74
2014,fire,MOLINE FIREFIGHTERS PENSION FUND,28377428.22,83241849.28
2014,fire,MONMOUTH FIREFIGHTERS PENSION FUND,4579173.07,12204300.3
2014,fire,MONTGOMERY & COUNTRYSIDE FPD FIREFIGHTER'S PENSION,279770.26,394670.33
2014,fire,MORRIS FIREFIGHTERS' PENSION FUND,51065.19,46220.51
2014,fire,MORTON GROVE FIREFIGHTERS PENSION FUND,29642059.16,57099363.07
2014,fire,MT CARMEL FIREFIGHTERS PENSION FUND,1502444.39,2724735.8
2014,fire,MT PROSPECT FIREFIGHTERS PENSION FUND,53726215.67,93425340.71
2014,fire,MT VERNON FIREFIGHTERS PENSION FUND,13599860.8,22916132.93
2014,fire,MT ZION FPD FIREFIGHTERS PENSION FUND,991462.99,982123.25
2014,fire,MUNDELEIN FIREFIGHTERS PENSION FUND,17100022.61,21691495.24
2014,fire,MURPHYSBORO FIREFIGHTERS PENSION FUND,4139286.87,8078191.77
2014,fire,NAPERVILLE FIREFIGHTERS PENSION FUND,128351932.2,172586586.2
2014,fire,NEW LENOX FPD FIREFIGHTERS PENSION FUND,2708833.69,2534412.46
2014,fire,NEWPORT TOWNSHIP FPD FIREFIGHTERS PENSION FUND,961747.58,1620918.03
2014,fire,NILES FIREFIGHTERS PENSION FUND,28768154.53,65286479.27
2014,fire,NORMAL FIREFIGHTERS PENSION FUND,26715633.34,47512707.28
2014,fire,NORTH AURORA FPD FIREFIGHTERS PENSION FUND,5494486.02,7035676.03
2014,fire,NORTH CHICAGO FIREFIGHTERS PENSION FUND,9247609.86,25484805.33
2014,fire,NORTH MAINE FPD FIREFIGHTERS PENSION FUND,18415442.56,29434292.17
2014,fire,NORTH PALOS FPD FIREFIGHTERS PENSION FUND,12275647.98,17380069.88
2014,fire,NORTH PARK FPD FIREFIGHTER'S PENSION FUND,107102.69,21534.89
2014,fire,NORTH RIVERSIDE FIREFIGHTERS PENSION FUND,8403802.08,23269849.91
2014,fire,NORTHBROOK FIREFIGHTERS PENSION FUND,45065047.58,74414690.19
2014,fire,NORTHLAKE FPD FIREFIGHTERS PENSION FUND,12921200.71,16386121.23
2014,fire,NORTHWEST HOMER FPD FIREFIGHTERS PENSION FUND,3160368.17,4461988.02
2014,fire,NORTHWEST ST CLAIR COUNTY FPD FIREFIGHTERS PENSION,607403.91,846558.23
2014,fire,NORWOOD PARK FPD FIREFIGHTERS PENSION FUND,13965169.86,26375856.51
2014,fire,NUNDA RURAL FPD FIREFIGHTERS PENSION FUND,9878.76,261226.63
2014,fire,OAK BROOK FIREFIGHTERS PENSION FUND,25329497.91,44156189.22
2014,fire,OAK FOREST FIREFIGHTERS PENSION FUND,17598733.17,24588945.3
2014,fire,OAK LAWN FIREFIGHTERS PENSION FUND,73489750.21,123696910.8
2014,fire,OAK PARK FIREFIGHTERS PENSION FUND,43247851.46,101016823.2
2014,fire,OAKBROOK TERRACE FIRE PROTECTION DISTRICT,1752472.17,3016076.34
2014,fire,OLNEY FIREFIGHTERS PENSION FUND,2172390.16,3873924.47
2014,fire,ORLAND FPD FIREFIGHTERS PENSION FUND,125858656,128801311.5
2014,fire,OSWEGO FPD FIREFIGHTERS PENSION FUND,8944869.57,9818758.26
2014,fire,OTTAWA FIREFIGHTERS PENSION FUND,13359845.87,26205315.18
2014,fire,PALATINE FIREFIGHTERS PENSION FUND,58720578.98,104317646.7
2014,fire,PALATINE RURAL FPD FIREFIGHTERS PENSION FUND,9742628.45,12567649.08
2014,fire,PALOS FPD PENSION FUND,12731931.67,16316476.44
2014,fire,PALOS HEIGHTS FPD PENSION FUND,8694999.84,13701874.69
2014,fire,PARIS FIREFIGHTERS PENSION FUND,5490969.85,10335333.62
2014,fire,PARK FOREST FIREFIGHTERS PENSION FUND,11473601.59,22953082.51
2014,fire,PARK RIDGE FIREFIGHTERS PENSION FUND,39437730.67,58303664.61
2014,fire,PEKIN FIREFIGHTERS PENSION FUND,21395752.78,54206417.54
2014,fire,PEORIA FIREFIGHTERS PENSION FUND,133063073.5,229585333.2
2014,fire,PEOTONE FPD FIREFIGHTERS PENSION FUND,1286816.96,1459620.81
2014,fire,PERU FIREFIGHTERS PENSION FUND,2085248.74,3535267.57
2014,fire,PINGREE GROVE & COUNTRYSIDE FPD FIREFIGHTER'S PENS,796095.51,2420712.36
2014,fire,PLAINFIELD FPD FIREFIGHTERS PENSION FUND,15434650.58,10303289.5
2014,fire,PLEASANTVIEW FPD,29765634.44,49773029.29
2014,fire,PONTIAC FIREFIGHTERS PENSION FUND,4263511.86,7621900.83
2014,fire,POSEN FIREFIGHTERS PENSION FUND,369592.45,1274887.27
2014,fire,PRINCETON FIREFIGHTERS PENSION FUND,6303615.93,8862647.82
2014,fire,PROSPECT HEIGHTS FPD FIREFIGHTERS PENSION FUND,3335336.36,4664609.76
2014,fire,QUINCY FIREFIGHTERS PENSION FUND,25966978.61,60434370.34
